靠湖比较近，采光无遮挡，诚心卖。,碧桂园凤凰城临湖苑 -凤凰城商圈,3室2厅 | 101.91平米 | 东南 南 | 简装 | 中楼层(共33层)  | 塔楼,70,"6,869元/平"
花山人家  好楼层  看房方便,花山人家 -宝华商圈,2室2厅 | 90平米 | 南 | 简装 | 低楼层(共6层)  | 板楼,43,"4,778元/平"
高入住率小区，交通便利，生活方便，采光好，看房方便,宝华花园 -宝华商圈,2室1厅 | 57.66平米 | 南 | 简装 | 低楼层(共6层)  | 板楼,44.5,"7,718元/平"
万达茂旁 三房 户型方正 房东诚心卖 看房方便,招商国际E城 -宝华商圈,3室1厅 | 91.28平米 | 南 | 简装 | 中楼层(共34层)  | 板楼,79,"8,655元/平"
央企开发商品牌 户型方正 采光充足,招商国际E城 -宝华商圈,3室1厅 | 92.98平米 | 南 | 精装 | 中楼层(共34层)  | 板楼,150,"16,133元/平"
此房满两年，朝南 空间宽敞 阳光充足,黄金花园东区 -句容主城商圈,3室2厅 | 122.6平米 | 南 | 精装 | 中楼层(共7层)  | 暂无数据,83.8,"6,836元/平"
仙林东宝华老镇山城美景步梯房楼层好精装,山城美景 -宝华商圈,2室2厅 | 63.91平米 | 南 | 精装 | 低楼层(共6层)  | 板楼,47,"7,355元/平"
宝华山环山景大平层    精装修带地暖   业主诚心出售,碧桂园大学印象 -宝华商圈,4室2厅 | 178平米 | 南 | 精装 | 中楼层(共25层)  | 板楼,145,"8,147元/平"
仙林东 碧桂园翡翠华府 精装三房 户型方正,碧桂园翡翠华府 -宝华商圈,3室1厅 | 115平米 | 南 | 精装 | 中楼层(共33层)  | 板楼,128,"11,131元/平"
宝华仙林东 负氧离子含量高  生活更,仙林印象 -宝华商圈,4室2厅 | 125.97平米 | 南 | 毛坯 | 中楼层(共33层)  | 塔楼,126,"10,003元/平"
南京仙林湖 央企招商E城 配套齐全 出行方便,招商国际E城 -宝华商圈,3室2厅 | 92.98平米 | 南 北 | 精装 | 高楼层(共34层)  | 板楼,103.5,"11,132元/平"
宝华精装两房，拎包入住，边户户型，楼层好，价格可谈,碧桂园仙林东郡 -宝华商圈,2室2厅 | 78.51平米 | 南 北 | 精装 | 高楼层(共23层)  | 板楼,55,"7,006元/平"
宝华精装两房，拎包入住，边户户型，楼层好，价格可谈,碧桂园仙林东郡 -宝华商圈,2室2厅 | 78.51平米 | 南 北 | 精装 | 高楼层(共23层)  | 板楼,55,"7,006元/平"
格局好，楼层好，采光足， 环境优美有仙气,九曲花苑 -宝华商圈,4室2厅 | 141平米 | 南 | 精装 | 低楼层(共6层)  | 板塔结合,166,"11,774元/平"
业主二次装修20万 全新装修 带车位 业主急售,碧桂园大学印象峰景苑 -宝华商圈,4室2厅 | 139.79平米 | 南 北 东 | 精装 | 高楼层(共14层)  | 暂无数据,129,"9,229元/平"
大三房前面湖 三房朝南 价格可以谈,碧桂园凤凰城芷兰湾 -凤凰城商圈,3室1厅 | 95.53平米 | 南 | 简装 | 低楼层(共11层)  | 塔楼,77.9,"8,155元/平"
房子户型好采光充足，位置好楼层佳.,凤坛花园 -宝华商圈,2室2厅 | 90平米 | 南 | 毛坯 | 7层  | 板塔结合,42.5,"4,723元/平"
青筑家园 精致两房 高楼层 居住舒适 满五,泰达青筑 -宝华商圈,2室2厅 | 82平米 | 南 | 精装 | 高楼层(共18层)  | 板楼,62,"7,561元/平"
九曲花苑 山景洋房 低密度两房 一楼含车位,九曲花苑 -宝华商圈,2室2厅 | 80平米 | 南 北 | 毛坯 | 低楼层(共8层)  | 平房,76,"9,500元/平"
泰达青筑，小区物业，环境好，总高18层,泰达青筑 -宝华商圈,2室1厅 | 70平米 | 南 北 | 精装 | 低楼层(共17层)  | 板楼,80,"11,429元/平"
东郊奥莱旁 小区环境好 适合居住 视野开阔,碧桂园世纪城邦 -郭庄商圈,3室2厅 | 116平米 | 南 北 | 精装 | 高楼层(共26层)  | 板楼,65,"5,604元/平"
99㎡三房一卫，二次装修，拎包入住。一口价房源,碧桂园世纪城邦 -郭庄商圈,3室2厅 | 98.45平米 | 南 北 | 精装 | 低楼层(共32层)  | 板楼,68.8,"6,989元/平"
润景美邻苑 3室2厅 南 北,润景美邻苑 -句容主城商圈,3室2厅 | 124.19平米 | 南 北 | 精装 | 低楼层(共6层)  | 板楼,89,"7,167元/平"
柏丽湾116平 景观好 视野开阔 地铁口,碧桂园凤凰城柏丽湾 -凤凰城商圈,3室2厅 | 119平米 | 南 | 精装 | 中楼层(共33层)  | 塔楼,82,"6,891元/平"
业主二次精装，家具家电齐全且新，有装暖气片,碧桂园凤凰城凤雅苑 -凤凰城商圈,3室2厅 | 136.21平米 | 南 | 精装 | 低楼层(共29层)  | 塔楼,80,"5,874元/平"
碧桂园凤凰城凤仪苑大四房 精装修,碧桂园凤凰城·凤仪苑 -凤凰城商圈,4室1厅 | 165.78平米 | 南 | 精装 | 中楼层(共30层)  | 塔楼,99,"5,972元/平"
仙林东  四季金辉    好楼层 三房 户型方正,四季金辉 -宝华商圈,3室2厅 | 88平米 | 南 | 毛坯 | 低楼层(共34层)  | 板楼,87,"9,887元/平"
南京东地铁口大平层 有车位 满两年 二次装修,碧桂园凤凰城水蓝湾 -凤凰城商圈,4室1厅 | 273.27平米 | 南 北 | 精装 | 高楼层(共33层)  | 塔楼,188,"6,880元/平"
万达茂旁 品质小区 四季金辉 人车分流 房东诚心出售,四季金辉 -宝华商圈,3室2厅 | 88.83平米 | 南 | 精装 | 中楼层(共34层)  | 塔楼,98,"11,033元/平"
二装，南北通透格局视野开阔一梯一户红木家具诚心卖,碧桂园凤凰城柏丽湾 -凤凰城商圈,4室2厅 | 179.55平米 | 南 北 | 精装 | 低楼层(共31层)  | 塔楼,125,"6,962元/平"
四季金辉边户 仙林大道旁  精装修 看房方便,四季金辉 -宝华商圈,4室2厅 | 100平米 | 南 | 精装 | 中楼层(共34层)  | 塔楼,113,"11,300元/平"
东边户，三开间朝南，好楼层，视野不错,朗诗万都玲珑樾 -宝华商圈,4室2厅 | 122.91平米 | 南 | 简装 | 高楼层(共9层)  | 板塔结合,225,"18,307元/平"
精装两房，业主诚心急售价格好谈,招商国际E城 -宝华商圈,2室2厅 | 78.39平米 | 南 北 | 精装 | 低楼层(共34层)  | 塔楼,78,"9,951元/平"
仙林东 伯爵山山景住宅 有钥匙 随时可以看房,碧桂园伯爵山 -宝华商圈,3室2厅 | 106平米 | 南 | 精装 | 低楼层(共18层)  | 板楼,88,"8,302元/平"
急急急，房东急售，采光好，视野好，看中可谈,香溪湾 -句容主城商圈,2室2厅 | 86.82平米 | 南 | 毛坯 | 中楼层(共31层)  | 暂无数据,95,"10,943元/平"
东方华城 四房双卫 精装修边户 很少住 讲究的来,东方华城 -句容主城商圈,4室2厅 | 157平米 | 南 北 | 精装 | 中楼层(共6层)  | 板楼,118,"7,516元/平"
仙林万达茂东 四季金辉 仙林大道旁 精 装 3房,四季金辉 -宝华商圈,4室2厅 | 107平米 | 南 北 | 精装 | 中楼层(共34层)  | 塔楼,130,"12,150元/平"
城南新小区，低密度，适合居住的天悦府,天悦府 -句容主城商圈,3室2厅 | 99.21平米 | 南 | 毛坯 | 中楼层(共19层)  | 塔楼,85,"8,568元/平"
四季金辉 3室2厅 南,四季金辉 -宝华商圈,3室2厅 | 87平米 | 南 | 精装 | 高楼层(共34层)  | 塔楼,80,"9,196元/平"
采光足视野开阔 西边户 中间楼层,花山人家 -宝华商圈,3室2厅 | 99.5平米 | 南 | 毛坯 | 中楼层(共6层)  | 板塔结合,75,"7,538元/平"
顶楼两层复式，视野开阔，采光充足,京东紫晶 -宝华商圈,4室2厅 | 111平米 | 南 | 精装 | 低楼层(共34层)  | 塔楼,80,"7,208元/平"
楼层好，视野宽阔，采光充足，配套设施完整，交通便利,京东紫晶 -宝华商圈,2室1厅 | 68平米 | 南 | 精装 | 中楼层(共35层)  | 塔楼,83,"12,206元/平"
满五唯一无抵押 精致俩房 三开间朝南 交通发达 价格优,恒大雅苑 -宝华商圈,2室2厅 | 89.16平米 | 南 | 精装 | 中楼层(共33层)  | 板楼,84,"9,422元/平"
京东紫晶，刚需，精装两房，楼层好，拎包入住,京东紫晶 -宝华商圈,2室2厅 | 61.29平米 | 南 | 简装 | 中楼层(共35层)  | 板楼,61,"9,953元/平"
此房视野开阔 采光足 户型方正 格局好交通便利,京东紫晶 -宝华商圈,3室2厅 | 79.81平米 | 南 | 精装 | 中楼层(共35层)  | 板楼,79,"9,899元/平"
仙林万达茂东 四季金辉 仙林大道旁 精 装 3房,四季金辉 -宝华商圈,4室2厅 | 107平米 | 南 北 | 精装 | 中楼层(共34层)  | 塔楼,130,"12,150元/平"
城南新小区，低密度，适合居住的天悦府,天悦府 -句容主城商圈,3室2厅 | 99.21平米 | 南 | 毛坯 | 中楼层(共19层)  | 塔楼,85,"8,568元/平"
位置好楼层好，电梯洋房总价低!,玉兰花园二期和园 -宝华商圈,3室2厅 | 110平米 | 南 | 精装 | 中楼层(共11层)  | 板楼,83,"7,546元/平"
高楼层 采光通风好 西边户 南北通透,上書房 -句容主城商圈,3室2厅 | 115平米 | 南 西 北 | 精装 | 高楼层(共33层)  | 板楼,105,"9,131元/平"
万达茂旁 品质小区 四季金辉 人车分流 房东诚心出售,四季金辉 -宝华商圈,3室2厅 | 88.83平米 | 南 | 精装 | 中楼层(共34层)  | 塔楼,98,"11,033元/平"
二装，南北通透格局视野开阔一梯一户红木家具诚心卖,碧桂园凤凰城柏丽湾 -凤凰城商圈,4室2厅 | 179.55平米 | 南 北 | 精装 | 低楼层(共31层)  | 塔楼,125,"6,962元/平"
玉清公园品质小区三房两卫好户型 楼层好省去爬楼烦恼,锦绣句容 -句容主城商圈,3室2厅 | 138平米 | 南 北 | 精装 | 低楼层(共7层)  | 板塔结合,74.9,"5,428元/平"
仙林东宝华新城满二无抵押精装山景房,香山壹境 -宝华商圈,3室1厅 | 79.85平米 | 南 | 精装 | 低楼层(共33层)  | 板楼,79,"9,894元/平"
万达茂旁 国企开发商 人车分流小区 精装修急售有钥匙,远洋心里 -宝华商圈,3室2厅 | 96.53平米 | 南 北 | 精装 | 中楼层(共34层)  | 板塔结合,87,"9,013元/平"
泰达国企 经典户型 三开间朝南 精装交付标准 随时看房,泰达青筑 -宝华商圈,3室2厅 | 88.78平米 | 南 | 精装 | 高楼层(共18层)  | 板楼,95,"10,701元/平"
万达茂旁翡翠华府精装修带地暖三房诚心出售,碧桂园翡翠华府 -宝华商圈,3室2厅 | 115平米 | 南 | 精装 | 高楼层(共33层)  | 板楼,115,"10,000元/平"
百米地铁口产证满五诚心卖，阳台封闭家电齐全采光好,碧桂园凤凰城翰林湾 -凤凰城商圈,3室2厅 | 122.9平米 | 南 | 精装 | 中楼层(共27层)  | 板楼,75,"6,103元/平"
地铁口精装小三房 出行方便 楼栋好采光好 户型方正,碧桂园凤凰城柏丽湾 -凤凰城商圈,3室2厅 | 90.54平米 | 南 | 精装 | 低楼层(共33层)  | 塔楼,62,"6,848元/平"
此房户型方正 楼层好 采光充足 三面采光，通透性好,天玺华府 -句容主城商圈,3室2厅 | 103.92平米 | 北 南 | 精装 | 高楼层(共32层)  | 板楼,113,"10,874元/平"
逸品汤山三期叠墅，五室两厅，户型好，房主急售,逸品汤山三期 -凤凰城商圈,5室2厅 | 196.05平米 | 东南 西北 | 毛坯 | 高楼层(共5层)  | 暂无数据,158,"8,060元/平"
精装修满两年 中间楼层 高附加 随时看房,天正理想城 -宝华商圈,3室2厅 | 87平米 | 南 | 精装 | 中楼层(共34层)  | 塔楼,74,"8,506元/平"
小区交通便利，户型采光足，实用面积多,五洲花苑 -句容主城商圈,3室2厅 | 106平米 | 南 北 | 毛坯 | 高楼层(共33层)  | 板楼,73,"6,887元/平"
仙林万达茂旁 精装三房 首望城,仙林首望城 -宝华商圈,3室2厅 | 89平米 | 东 南 东南 | 精装 | 高楼层(共33层)  | 板楼,150,"16,854元/平"
碧桂园凤凰城芷兰湾 一楼带院子 业主诚心出售,碧桂园凤凰城芷兰湾 -凤凰城商圈,3室2厅 | 111平米 | 南 北 | 精装 | 低楼层(共33层)  | 塔楼,75,"6,757元/平"
楼层好，视野宽阔，采光充足，配套设施齐全，交通便利,仙林悦城 -宝华商圈,3室2厅 | 81.8平米 | 南 | 精装 | 高楼层(共33层)  | 板楼,70,"8,558元/平"
柏丽湾 近地铁小三房 前无遮挡全天采光 好楼层,碧桂园凤凰城柏丽湾 -凤凰城商圈,3室2厅 | 90.42平米 | 南 | 精装 | 低楼层(共32层)  | 塔楼,56,"6,194元/平"
二装  边户  三房两卫  带车位,碧桂园世纪城邦 -郭庄商圈,3室2厅 | 116平米 | 南 北 | 精装 | 低楼层(共30层)  | 板楼,63,"5,432元/平"
台北上上城精装修二房二厅一卫出售,台北上上城 -句容主城商圈,3室2厅 | 89.57平米 | 南 北 | 精装 | 高楼层(共6层)  | 板塔结合,52,"5,806元/平"
好楼层 采光好 视野开阔 配套设施齐全,上路新居 -句容主城商圈,3室2厅 | 145平米 | 东 南 | 毛坯 | 低楼层(共28层)  | 暂无数据,75,"5,173元/平"
茶香苑小区 3-2-1-1  111.30m²,茶香苑小区 -句容主城商圈,3室2厅 | 111.3平米 | 南 | 毛坯 | 高楼层(共11层)  | 暂无数据,38,"3,415元/平"
二房朝南的中间楼层 房东刚搬家现空置中,世茂花园 -句容主城商圈,2室1厅 | 84.71平米 | 南 | 精装 | 中楼层(共30层)  | 板楼,60,"7,083元/平"
碧桂园翰林湾前后院子，领包入住，满二随时可以过户,碧桂园凤凰城翰林湾 -凤凰城商圈,3室2厅 | 133.74平米 | 东南 | 精装 | 低楼层(共33层)  | 塔楼,108,"8,076元/平"
台北上上城精装修二房二厅一卫出售,台北上上城 -句容主城商圈,3室2厅 | 89.57平米 | 南 北 | 精装 | 高楼层(共6层)  | 板塔结合,52,"5,806元/平"
茶香苑小区 3-2-1-1  111.30m²,茶香苑小区 -句容主城商圈,3室2厅 | 111.3平米 | 南 | 毛坯 | 高楼层(共11层)  | 暂无数据,38,"3,415元/平"
二房朝南的中间楼层 房东刚搬家现空置中,世茂花园 -句容主城商圈,2室1厅 | 84.71平米 | 南 | 精装 | 中楼层(共30层)  | 板楼,60,"7,083元/平"
楼层好，采光足，视野好，户型方正,春天里 -宝华商圈,2室1厅 | 101平米 | 南 | 精装 | 低楼层(共33层)  | 板塔结合,75,"7,426元/平"
四季金辉 户型通透 有钥匙 看房方便,四季金辉 -宝华商圈,3室1厅 | 79平米 | 南 北 | 毛坯 | 低楼层(共34层)  | 板楼,82,"10,380元/平"
碧桂园仙林东郡 自持物业 齐全 满两年精装修 交通便利,碧桂园仙林东郡 -宝华商圈,2室2厅 | 106平米 | 南 | 精装 | 高楼层(共33层)  | 塔楼,60,"5,661元/平"
房间格局好，采光好无遮挡，合理利用空间，户型方正,建中御东国际六期 -句容主城商圈,4室2厅 | 89平米 | 南 | 毛坯 | 低楼层(共34层)  | 板楼,68,"7,641元/平"
四季金辉 仙林东恒大旁交通便利 中等楼层 看房便利,四季金辉 -宝华商圈,3室2厅 | 86.14平米 | 南 | 精装 | 低楼层(共34层)  | 塔楼,88,"10,216元/平"
视野开阔无遮挡，采光充足房子装修很新交通便利视野开,招商国际E城 -宝华商圈,2室2厅 | 69.74平米 | 南 北 | 精装 | 高楼层(共34层)  | 板塔结合,100.5,"14,411元/平"
三室两房朝南，户型方正无遮挡满二业主诚心卖南北通透,碧桂园凤凰城芷兰湾 -凤凰城商圈,3室2厅 | 133平米 | 南 北 | 精装 | 低楼层(共18层)  | 塔楼,76,"5,715元/平"
仙林东，精装两房，房东急售，急售，急售 ，急售,天正理想城 -宝华商圈,3室2厅 | 88.15平米 | 南 | 精装 | 低楼层(共34层)  | 塔楼,66,"7,488元/平"
此房满二， 业主二次欧式装修，保养很好，拎包入住,碧桂园凤凰城翰林湾 -凤凰城商圈,3室2厅 | 133.41平米 | 东南 南 | 精装 | 中楼层(共33层)  | 塔楼,102,"7,646元/平"
婚房配置 业主诚心出售 看中价格可谈 家电家具不带走,泰达青筑 -宝华商圈,2室2厅 | 81.38平米 | 南 | 精装 | 低楼层(共18层)  | 板楼,65,"7,988元/平"
格局好，楼层好，采光足，视野开阔，朝南,碧桂园翡翠华府 -宝华商圈,3室1厅 | 95平米 | 南 | 精装 | 中楼层(共32层)  | 板楼,110,"11,579元/平"
碧桂园房子，精装修。房东好讲话,仙林悦城 -宝华商圈,2室1厅 | 64.75平米 | 南 | 精装 | 高楼层(共33层)  | 板楼,43,"6,641元/平"
四季金辉，家具家电全新，业主诚心出售。,四季金辉 -宝华商圈,2室1厅 | 74.28平米 | 南 | 精装 | 中楼层(共34层)  | 塔楼,78,"10,501元/平"
环境好，小区绿化高，交通便利，采光好，看房方便,春天里 -宝华商圈,3室2厅 | 118.94平米 | 南 | 简装 | 高楼层(共33层)  | 板塔结合,80,"6,727元/平"
换房急售！有客户联系我！装修很好，品牌家具,碧桂园·中央公园 -句容主城商圈,3室2厅 | 115.4平米 | 南 | 精装 | 高楼层(共30层)  | 暂无数据,82,"7,106元/平"
仙林东 碧桂园翡翠华府 精装三房 楼层佳 户型方正,碧桂园翡翠华府二期 -宝华商圈,3室2厅 | 96.52平米 | 南 | 精装 | 高楼层(共32层)  | 塔楼,135,"13,987元/平"
东郊奥莱旁 三房两卫 小区环境优美,碧桂园世纪城邦 -郭庄商圈,3室2厅 | 118平米 | 南 北 | 精装 | 低楼层(共27层)  | 板楼,69,"5,848元/平"
南京下一站，距离黄梅站400米左右，4房两厅带私家露台,碧桂园凤凰城翰林湾 -凤凰城商圈,4室2厅 | 128.08平米 | 南 北 | 精装 | 高楼层(共27层)  | 板楼,81.9,"6,395元/平"
碧桂园24小时管家式贴心服务。物业保安退伍军人,碧桂园凤凰城水蓝湾 -凤凰城商圈,3室2厅 | 92.52平米 | 东南 南 | 精装 | 低楼层(共32层)  | 塔楼,70,"7,566元/平"
此房满二，中间楼层，边户双面采光，精装修靠地铁口,碧桂园凤凰城水蓝湾 -凤凰城商圈,3室2厅 | 123.22平米 | 东南 南 | 精装 | 高楼层(共32层)  | 塔楼,61,"4,951元/平"
仙林东  万达茂 旁   京东紫晶2房  满两年,京东紫晶 -宝华商圈,2室1厅 | 61.93平米 | 东北 | 精装 | 高楼层(共35层)  | 板塔结合,41,"6,621元/平"
万达茂东 近地铁 品质小区 品牌物业 户型方正 采光好,招商国际E城 -宝华商圈,2室1厅 | 69.83平米 | 南 | 精装 | 高楼层(共34层)  | 塔楼,57,"8,163元/平"
京东紫晶 婚装两房 满二年 诚心出售,京东紫晶 -宝华商圈,2室2厅 | 72.8平米 | 南 | 精装 | 低楼层(共35层)  | 塔楼,69,"9,479元/平"
京东精装三房，民用水电，楼层好，户型方正,京东紫晶 -宝华商圈,3室2厅 | 73平米 | 南 | 简装 | 中楼层(共35层)  | 塔楼,66,"9,042元/平"
精装修加地暖  诚心出售  看房方便,碧桂园伯爵山 -宝华商圈,3室2厅 | 132平米 | 南 | 精装 | 高楼层(共18层)  | 板楼,100,"7,576元/平"
京东紫晶精装2房低价 价格可以谈 楼层好,京东紫晶 -宝华商圈,2室1厅 | 55平米 | 南 | 精装 | 低楼层(共35层)  | 板塔结合,49,"8,910元/平"
朗诗三横系统，业主诚心出售，视野位置好,朗诗万都玲珑樾 -宝华商圈,3室2厅 | 87.15平米 | 南 西 | 精装 | 高楼层(共9层)  | 板塔结合,148,"16,983元/平"
京东紫晶 婚装两房 满二年 诚心出售,京东紫晶 -宝华商圈,2室2厅 | 72.8平米 | 南 | 精装 | 低楼层(共35层)  | 塔楼,69,"9,479元/平"
仙林东  万达茂 旁   京东紫晶2房  满两年,京东紫晶 -宝华商圈,2室1厅 | 61.93平米 | 东北 | 精装 | 高楼层(共35层)  | 板塔结合,41,"6,621元/平"
碧桂园24小时管家式贴心服务。物业保安退伍军人,碧桂园凤凰城水蓝湾 -凤凰城商圈,3室2厅 | 92.52平米 | 东南 南 | 精装 | 低楼层(共32层)  | 塔楼,70,"7,566元/平"
东郊奥莱旁 三房两卫 小区环境优美,碧桂园世纪城邦 -郭庄商圈,3室2厅 | 118平米 | 南 北 | 精装 | 低楼层(共27层)  | 板楼,69,"5,848元/平"
恒大精装三房 满2年 前后无遮挡 带露台,恒大雅苑 -宝华商圈,3室2厅 | 103平米 | 南 | 精装 | 低楼层(共33层)  | 塔楼,84,"8,156元/平"
恒大雅苑 大三房 采光充足   地下停车  出行方便,恒大雅苑 -宝华商圈,3室2厅 | 147.99平米 | 南 北 | 精装 | 中楼层(共31层)  | 塔楼,140,"9,461元/平"
此房满2年楼层好视野好位置好户型方正,四季金辉 -宝华商圈,3室1厅 | 88平米 | 南 | 毛坯 | 低楼层(共34层)  | 塔楼,90,"10,228元/平"
新装修 未入住 随时看房 两房和客厅朝南 全天采光,天正理想城 -宝华商圈,3室2厅 | 88平米 | 南 | 简装 | 高楼层(共34层)  | 塔楼,67.8,"7,705元/平"
碧桂园凤凰城临湖苑经典小三房拎包入住,碧桂园凤凰城临湖苑 -凤凰城商圈,3室2厅 | 99.26平米 | 南 北 | 精装 | 低楼层(共33层)  | 塔楼,60,"6,045元/平"
诚心出售，拎包入住，三面景观，有附房，满两年，,千禧小区 -句容主城商圈,3室2厅 | 116平米 | 南 北 | 精装 | 6层  | 暂无数据,49.9,"4,302元/平"
濠锋星钻 精装 准新房 地铁沿线 采光好,濠锋星钻 -宝华商圈,2室2厅 | 82平米 | 南 | 精装 | 中楼层(共34层)  | 板塔结合,69,"8,415元/平"
仙林东恒大雅苑精装设施齐全拎包入住,恒大雅苑 -宝华商圈,3室2厅 | 130.62平米 | 南 | 精装 | 低楼层(共26层)  | 塔楼,125,"9,570元/平"
急卖急卖，二次装修，多层洋房，山景美宅，诚心急卖,碧桂园仙林东郡 -宝华商圈,4室2厅 | 120平米 | 南 | 精装 | 高楼层(共33层)  | 塔楼,110,"9,167元/平"
小区绿化多样环境好，自带配套，楼下就是大*市,碧桂园仙林东郡 -宝华商圈,2室2厅 | 78.19平米 | 南 | 精装 | 高楼层(共33层)  | 塔楼,68,"8,697元/平"
多层洋房 好楼层 4室2卫 精装修 配套齐全,德院上城 -句容主城商圈,4室2厅 | 136.08平米 | 南 北 | 精装 | 中楼层(共5层)  | 暂无数据,105,"7,717元/平"
恒大雅苑大面积业主诚心出售无按揭产权清晰,恒大雅苑 -宝华商圈,4室2厅 | 148平米 | 南 | 精装 | 高楼层(共31层)  | 塔楼,152,"10,271元/平"
业主诚心出售  采光好  生活便利,朗诗万都玲珑樾 -宝华商圈,4室2厅 | 115平米 | 南 | 毛坯 | 低楼层(共7层)  | 板塔结合,151,"13,131元/平"
房子格局好，主卧朝南，楼层好，交通便利。,凤坛花园 -宝华商圈,2室2厅 | 90.67平米 | 南 | 毛坯 | 7层  | 板塔结合,50,"5,515元/平"
宝华山下小高层中高楼层，双卧朝南两房,泰达青筑 -宝华商圈,2室2厅 | 80.88平米 | 南 北 | 精装 | 高楼层(共18层)  | 板楼,79,"9,768元/平"
宝华山下  复式洋房  可观宝华山  空气新鲜,朗诗万都玲珑樾 -宝华商圈,4室2厅 | 127平米 | 东 | 毛坯 | 高楼层(共9层)  | 板楼,330,"25,985元/平"
仙林东大学印象精装带地暖，楼层好视野佳,碧桂园大学印象 -宝华商圈,4室2厅 | 142.87平米 | 南 | 精装 | 中楼层(共17层)  | 板楼,144.5,"10,115元/平"
仙林印象 舒适跃层 上下两层 双阳台,仙林印象 -宝华商圈,4室2厅 | 138平米 | 南 | 毛坯 | 高楼层(共27层)  | 塔楼,149,"10,798元/平"
大学印象双阳台 山景房带车位 纯东户 楼层好跳楼价,碧桂园大学印象 -宝华商圈,3室2厅 | 97平米 | 南 | 精装 | 中楼层(共31层)  | 板楼,81,"8,351元/平"
万达茂地房户型好南北通透房东急售,天正理想城 -宝华商圈,3室2厅 | 105平米 | 南 北 | 简装 | 中楼层(共34层)  | 塔楼,108,"10,286元/平"
仙林东   万达茂     彩虹城3房   业主诚心出售,彩虹城 -宝华商圈,3室2厅 | 83.63平米 | 南 | 简装 | 高楼层(共33层)  | 板楼,77,"9,208元/平"
楼层好，采光充足。交通便利。配套齐全。,恒大雅苑 -宝华商圈,4室2厅 | 164.15平米 | 南 | 精装 | 高楼层(共33层)  | 塔楼,192,"11,697元/平"
濠锋星钻精装加地暖交付2房出售  免费带看  随时看房,濠锋星钻 -宝华商圈,2室2厅 | 83平米 | 南 | 精装 | 高楼层(共31层)  | 塔楼,72,"8,675元/平"
仙林东   仙林东郡   精装洋房   采光足  位置好,碧桂园仙林东郡 -宝华商圈,3室2厅 | 82.46平米 | 南 | 精装 | 高楼层(共11层)  | 板楼,78,"9,460元/平"
仙林东 宝华山下  精装修  交通方便  配套齐全,碧桂园伯爵山 -宝华商圈,3室2厅 | 114平米 | 南 | 精装 | 高楼层(共18层)  | 板楼,114,"10,000元/平"
宝华花园 有大阁楼 有储藏室 毛坯 有证 急卖,宝华花园 -宝华商圈,3室2厅 | 100平米 | 南 | 毛坯 | 高楼层(共7层)  | 板楼,53,"5,300元/平"
视野宽阔，采光好，小区环境 好 ，无遮挡,碧桂园大学印象峰景苑 -宝华商圈,4室2厅 | 133平米 | 西南 | 简装 | 中楼层(共11层)  | 板塔结合,150,"11,279元/平"
山景房，一梯一户，视野好，采光好，南北通风。,碧桂园大学印象峰景苑 -宝华商圈,4室2厅 | 125.36平米 | 南 | 精装 | 高楼层(共18层)  | 板塔结合,107,"8,536元/平"
此房由小永来维护.采光好，，视野开阔，配套齐全，,朗诗万都玲珑樾 -宝华商圈,3室2厅 | 92.27平米 | 南 北 | 毛坯 | 低楼层(共19层)  | 板塔结合,95,"10,296元/平"
城北 台北上上城 多层4楼 毛坯 3房,台北上上城 -句容主城商圈,3室2厅 | 94平米 | 南 北 | 毛坯 | 中楼层(共5层)  | 板塔结合,62,"6,596元/平"
宝华山下 花园洋房 环境舒适宜居,朗诗万都玲珑樾 -宝华商圈,3室2厅 | 92平米 | 南 | 毛坯 | 中楼层(共8层)  | 板塔结合,91,"9,892元/平"
万达茂旁 方正两房总价低 小区有幼儿园  配套齐全,天正理想城 -宝华商圈,2室2厅 | 74平米 | 南 | 毛坯 | 高楼层(共34层)  | 板楼,57,"7,703元/平"
宝华山脚下，依山傍水，出行便利，价格美丽,碧桂园大学印象 -宝华商圈,4室1厅 | 125.6平米 | 南 | 精装 | 低楼层(共31层)  | 平房,130,"10,351元/平"
仙林东 万达茂 经天路 翡翠华府精装三房,碧桂园翡翠华府 -宝华商圈,3室2厅 | 115.18平米 | 南 | 精装 | 中楼层(共28层)  | 板楼,117,"10,159元/平"
低密度小区业主自装户型方正生活设施齐全,帝源都小区二期 -宝华商圈,3室2厅 | 103.51平米 | 南 | 简装 | 中楼层(共18层)  | 板楼,86,"8,309元/平"
