亚泰梧桐世家 3室2厅 南,亚泰梧桐世家 -大厂,3室2厅 | 125.5平米 | 南 | 精装 | 高楼层(共26层)  | 塔楼,135,"10,757元/平"
南京六合区70年产权商品房 精装大2房 首付低采光好,东骏华府 -六合其它,2室2厅 | 84.21平米 | 南 北 | 精装 | 低楼层(共11层)  | 板楼,42,"4,988元/平"
中杨新村 葛塘地铁口房源 中间楼层 诚心出,中杨新村 -大厂,2室1厅 | 76.35平米 | 南 北 | 简装 | 中楼层(共6层)  | 板楼,81,"10,610元/平"
扬子十六村 双南 中间楼层 采光好 集中供暖 近地铁,扬子十六村 -大厂,2室1厅 | 56.08平米 | 南 | 简装 | 中楼层(共6层)  | 板楼,69.5,"12,394元/平"
盘金华府 南北朝向 采光好 地铁口 桃湖公园 大三房,盘金华府 -大厂,3室1厅 | 113.51平米 | 南 北 | 简装 | 高楼层(共6层)  | 板楼,135,"11,894元/平"
大厂地铁口 荣盛阿卡大三房 简装,荣盛阿尔卡迪亚 -大厂,3室1厅 | 118.82平米 | 南 | 简装 | 低楼层(共9层)  | 板楼,150,"12,625元/平"
此房满五年 采光好 交通便利好楼层,荣盛阿尔卡迪亚 -大厂,2室2厅 | 86.11平米 | 南 | 简装 | 中楼层(共18层)  | 板楼,110,"12,775元/平"
芳庭潘园 中间楼层 三房 近地铁 户型方正 全明,芳庭潘园 -大厂,3室1厅 | 89.79平米 | 南 | 简装 | 高楼层(共6层)  | 板楼,92,"10,247元/平"
此房一梯两户 大两房 两房朝南 配套设施都很完善,扬子二村 -大厂,2室1厅 | 51.41平米 | 南 | 其他 | 中楼层(共6层)  | 板楼,60,"11,671元/平"
宝润花园 地铁口736米 拎包入住 交通便利 配套齐全,宝润花园 -大厂,3室2厅 | 103.86平米 | 南 北 | 其他 | 低楼层(共6层)  | 板楼,99,"9,533元/平"
紫艺华府 3室2厅 南,紫艺华府 -大厂,3室2厅 | 89.57平米 | 南 | 简装 | 高楼层(共18层)  | 板楼,115,"12,840元/平"
盘金华府，采光好 位置佳，设施齐全，交通便利。,盘金华府 -大厂,3室2厅 | 108.86平米 | 南 | 其他 | 高楼层(共6层)  | 板楼,135,"12,402元/平"
杨庄西村地铁口 满5年 中间楼层 电厂职工福利房,杨庄西村 -大厂,2室1厅 | 59.59平米 | 南 北 | 简装 | 中楼层(共6层)  | 板塔结合,65,"10,908元/平"
芳庭潘园 一室一厅 配套齐全你交通方便 房主诚心卖,芳庭潘园 -大厂,1室1厅 | 41.66平米 | 南 | 毛坯 | 低楼层(共6层)  | 板楼,63,"15,123元/平"
新华二村 满五唯一 精装修 拎包入住 交通生活便利,新华二村 -大厂,2室1厅 | 57.08平米 | 南 | 精装 | 中楼层(共5层)  | 板塔结合,60,"10,512元/平"
湖滨村 满五年唯一  户型好 采光好 近地铁 配套成熟,湖滨村 -大厂,2室1厅 | 55平米 | 南 北 | 简装 | 中楼层(共7层)  | 板楼,47,"8,546元/平"
阿尔卡迪亚，小区中间位置，中间楼层，采光好,荣盛阿尔卡迪亚 -大厂,3室2厅 | 109.57平米 | 南 北 | 精装 | 中楼层(共9层)  | 板塔结合,170,"15,516元/平"
碧景山庄 三房 边户 南北贯通 双阳台 二卫,碧景山庄 -大厂,3室1厅 | 117.35平米 | 南 | 精装 | 中楼层(共18层)  | 板塔结合,130,"11,078元/平"
阿尔卡迪亚 中高楼层 正三房 采光很好,荣盛阿尔卡迪亚 -大厂,3室2厅 | 107.65平米 | 东南 | 简装 | 高楼层(共18层)  | 板楼,138,"12,820元/平"
凤南园  简单装修三房  带露台相当于小院子 总价底,凤南园 -大厂,3室1厅 | 81.6平米 | 南 | 简装 | 低楼层(共6层)  | 暂无数据,80,"9,804元/平"
阿卡精装三房 中间楼层 带储藏室 有租的车位 设施齐全,荣盛阿尔卡迪亚 -大厂,3室2厅 | 110.71平米 | 南 | 精装 | 中楼层(共6层)  | 板楼,160,"14,453元/平"
荣盛阿尔卡迪亚 满五唯一 二房 近地铁 拎包入住,荣盛阿尔卡迪亚 -大厂,2室1厅 | 78.03平米 | 南 | 简装 | 低楼层(共18层)  | 板楼,98,"12,560元/平"
南钢六村 好楼层  有钥匙看房方便 近地铁,大厂南钢六村 -大厂,2室1厅 | 64.65平米 | 南 | 简装 | 低楼层(共6层)  | 板塔结合,59,"9,127元/平"
此房满五唯一 南北互通 适合刚需人群,盘金华府 -大厂,2室1厅 | 84.03平米 | 南 北 | 其他 | 高楼层(共6层)  | 板楼,88,"10,473元/平"
冠城大通一期 毛坯两房 好楼层 视野开阔 南北户型,冠城大通蓝郡 -龙池,2室1厅 | 72.29平米 | 南 | 简装 | 高楼层(共18层)  | 板塔结合,68,"9,407元/平"
扬子一中后门200米  一楼带院子 院子有房,扬子九村 -大厂,3室1厅 | 62.95平米 | 南 | 简装 | 低楼层(共6层)  | 板楼,105,"16,680元/平"
新华五村三楼 两房朝南 采光好 满五唯一,新华五村 -大厂,2室1厅 | 63.01平米 | 南 | 简装 | 中楼层(共7层)  | 板楼,75,"11,903元/平"
扬子十五村精装三房 配套成熟拎包入住,扬子十五村 -大厂,3室1厅 | 69.17平米 | 南 | 其他 | 高楼层(共6层)  | 板楼,72,"10,410元/平"
中间楼层 满五唯一 诚心卖房 配套齐全,荣盛阿尔卡迪亚 -大厂,3室2厅 | 98.95平米 | 南 | 精装 | 中楼层(共18层)  | 板楼,122,"12,330元/平"
诚售 江北新区 扬子五村 暖气房 中间楼层,扬子五村 -大厂,2室1厅 | 62.23平米 | 南 | 简装 | 中楼层(共7层)  | 板楼,58,"9,321元/平"
扬子三村暖气房 中间楼层 采光充足  拎包入住,扬子三村 -大厂,2室0厅 | 46.81平米 | 南 北 | 简装 | 低楼层(共6层)  | 板楼,50,"10,682元/平"
龙湖棠城 2室1厅 南,龙湖棠城 -南门新城,2室1厅 | 65平米 | 南 | 其他 | 低楼层(共20层)  | 板楼,76,"11,693元/平"
江北新区 桃湖公园 配套齐全 交通方便 楼层好,九龙洼 -大厂,2室1厅 | 64.61平米 | 南 | 简装 | 高楼层(共6层)  | 暂无数据,50,"7,739元/平"
江北新区 盘金华府 南信大地铁口 精装修 拎包入住,盘金华府 -大厂,2室2厅 | 87.45平米 | 南 北 | 其他 | 中楼层(共6层)  | 板楼,101,"11,550元/平"
葛塘新城 精装修暖气三房 品质小区提包入住,卓越蔚蓝星宸苑 -大厂,3室1厅 | 86.02平米 | 南 | 其他 | 中楼层(共16层)  | 板楼,110,"12,788元/平"
荣盛首府 改善大三房 楼层佳 业主诚心卖 看房随时,荣盛首府 -大厂,3室2厅 | 126.78平米 | 南 | 毛坯 | 高楼层(共18层)  | 板楼,185,"14,593元/平"
网红小区卸甲甸地铁口仁锦苑一室一厅电梯房拎包入住,仁锦苑 -大厂,1室1厅 | 48.35平米 | 南 北 | 其他 | 高楼层(共33层)  | 板楼,54,"11,169元/平"
葛塘地铁站 扬子暖气两室 新房龄 采光无遮挡诚心出售,扬子十七村 -大厂,2室1厅 | 59.07平米 | 南 北 | 精装 | 高楼层(共6层)  | 板楼,75,"12,697元/平"
房主诚心出售 S8龙池地铁站旁 随时看房,冠城大通蓝郡 -龙池,2室2厅 | 74.02平米 | 南 | 精装 | 高楼层(共18层)  | 板塔结合,71,"9,593元/平"
骋望七里楠花园 简装三房 交通便利 配套成熟,骋望七里楠花园 -龙池,3室1厅 | 91.65平米 | 南 | 简装 | 高楼层(共24层)  | 板楼,65,"7,093元/平"
葛塘新空电梯房中上楼层采光刺眼,君悦花园 -大厂,2室2厅 | 87.25平米 | 南 | 毛坯 | 中楼层(共20层)  | 板楼,69,"7,909元/平"
宝润花园 商品房 地铁口  南北通透 配套齐全 2004年,宝润花园 -大厂,3室1厅 | 100.88平米 | 南 北 | 精装 | 高楼层(共6层)  | 板楼,91,"9,021元/平"
晓山北村新房龄的 总价低 500米到卸甲甸地铁口,晓山北村南苑 -大厂,3室2厅 | 78.96平米 | 南 | 简装 | 中楼层(共6层)  | 板楼,89,"11,272元/平"
电梯次新房改善中间好楼层交通便利走路到大厂地铁站小,荣盛阿尔卡迪亚 -大厂,2室1厅 | 89.31平米 | 南 | 精装 | 中楼层(共18层)  | 板楼,113,"12,653元/平"
骋望七里楠花园 舒适大平层  电梯大四房  诚心出售,骋望七里楠花园 -龙池,3室1厅 | 173.27平米 | 南 | 其他 | 低楼层(共25层)  | 板楼,105,"6,060元/平"
仁锦苑  房龄新 中间楼层 小区中间位置,仁锦苑 -大厂,3室2厅 | 121.24平米 | 南 | 简装 | 低楼层(共33层)  | 板楼,148,"12,208元/平"
文承苑 精装两房 二楼 家电齐全 拎包入住,荣盛文承苑 -大厂,2室1厅 | 64.95平米 | 南 | 其他 | 低楼层(共18层)  | 板塔结合,85,"13,087元/平"
s8大厂站户型格局合理，双卫。楼层好，通风采光上乘,荣盛阿尔卡迪亚 -大厂,3室2厅 | 108.45平米 | 南 | 精装 | 中楼层(共11层)  | 板塔结合,145,"13,371元/平"
荣盛文承熙苑.全新小区.环境优美.电梯暖气房.,荣盛文承熙苑 -大厂,3室2厅 | 86.84平米 | 南 | 毛坯 | 中楼层(共18层)  | 板楼,112,"12,898元/平"
此房南北户型格局，双卧朝南，客厅带阳台 户型全明,紫艺华府 -大厂,3室2厅 | 94.01平米 | 东 | 毛坯 | 中楼层(共18层)  | 板楼,122,"12,978元/平"
房主诚心出售，价格不高，客户真心购买价格还有空间。,杨庄北村 -大厂,2室0厅 | 45.77平米 | 南 | 其他 | 中楼层(共5层)  | 板楼,43.8,"9,570元/平"
晓山北村 双南 满五唯一 中间楼层 近地铁,晓山北村 -大厂,2室1厅 | 74.4平米 | 南 | 简装 | 中楼层(共6层)  | 板塔结合,78,"10,484元/平"
草芳新苑 有车位 地下车库也装修了 拎包住,草芳新苑 -大厂,3室2厅 | 88平米 | 南 | 其他 | 高楼层(共6层)  | 板楼,95,"10,796元/平"
产权清晰。楼层好。视野宽阔。采光充足。设施齐全。,骋望七里楠花园 -龙池,2室1厅 | 83平米 | 南 | 简装 | 中楼层(共24层)  | 暂无数据,56,"6,747元/平"
欧风花苑 满五年 看房随时 精装修 价格可谈,欧风花苑 -龙池,3室2厅 | 101.23平米 | 南 | 其他 | 高楼层(共6层)  | 板楼,68,"6,718元/平"
文承苑 精装三房 有租的车位 看房方便,荣盛文承苑 -大厂,3室1厅 | 94.09平米 | 南 | 精装 | 高楼层(共18层)  | 板塔结合,128,"13,604元/平"
草芳新苑三房 满五唯一 双南 全明 带阁楼 有大储藏室,草芳新苑 -大厂,4室2厅 | 92.22平米 | 南 | 精装 | 高楼层(共6层)  | 板楼,99.8,"10,822元/平"
江北新区 卸甲甸地铁站 泰亿步行街  晓山北村南苑,晓山北村南苑 -大厂,3室1厅 | 79.97平米 | 南 | 精装 | 高楼层(共6层)  | 板楼,74,"9,254元/平"
海棠花园 满五唯一 二外旁边  总价低,海棠花园 -大厂,2室1厅 | 57.66平米 | 南 | 其他 | 中楼层(共5层)  | 板楼,66,"11,447元/平"
扬子七村 精装两房 好楼层 只要你出价 好谈,扬子七村 -大厂,2室1厅 | 46.81平米 | 南 北 | 简装 | 中楼层(共6层)  | 板楼,52,"11,109元/平"
恒大养生谷精装修电梯房有地暖新风系统方便看诚心出售,南京恒大养生谷 -六合其它,3室2厅 | 107.63平米 | 南 北 | 精装 | 高楼层(共6层)  | 板楼,81,"7,526元/平"
九龙洼 2室1厅 南 北,九龙洼 -大厂,2室1厅 | 52.47平米 | 南 北 | 简装 | 中楼层(共5层)  | 板楼,48,"9,149元/平"
新华七村 三楼 两房朝南 有储藏室,新华七村 -大厂,2室1厅 | 67.39平米 | 南 | 精装 | 中楼层(共6层)  | 板楼,74,"10,981元/平"
中楼层 文承熙苑  户型通透  3房2厅精装  价格可谈,荣盛文承熙苑 -大厂,3室2厅 | 88.73平米 | 南 北 | 其他 | 中楼层(共18层)  | 板楼,199,"22,428元/平"
此房满两年。楼层好。视野宽阔。采光充足。,荣城中苑 -南门新城,3室1厅 | 90.42平米 | 南 | 简装 | 低楼层(共18层)  | 板塔结合,104,"11,502元/平"
凤南园，三房出售，采光好，房东诚心卖,凤南园 -大厂,3室1厅 | 90.97平米 | 南 | 其他 | 高楼层(共7层)  | 暂无数据,105,"11,543元/平"
楼层好，户型好，地理位置好，生活便利，真正适合居住,腾泰雅苑 -大厂,3室2厅 | 94.44平米 | 南 | 其他 | 中楼层(共6层)  | 板楼,180,"19,060元/平"
扬子二十一村 暖气房 电梯 交通便利 配套齐全采光充足,扬子二十一村 -大厂,3室1厅 | 95.82平米 | 南 | 其他 | 中楼层(共18层)  | 板楼,190,"19,829元/平"
钻石华府 精装两房 采光视线无挡 交通便利,钻石华府 -南门新城,2室2厅 | 83.27平米 | 南 北 | 精装 | 低楼层(共6层)  | 板楼,107,"12,850元/平"
九龙洼 总价低 诚心出售 价格看好可谈 均价1万左,九龙洼 -大厂,3室1厅 | 63.74平米 | 南 北 | 其他 | 高楼层(共6层)  | 板塔结合,59,"9,257元/平"
福基紫景园大两房 全明户型 交通方便急卖价可谈,福基紫景园 -大厂,2室2厅 | 94.77平米 | 南 | 精装 | 高楼层(共6层)  | 板楼,100,"10,552元/平"
芳庭潘园 江北新区 S8地铁口  有储藏室,芳庭潘园 -大厂,2室1厅 | 60.5平米 | 南 | 简装 | 高楼层(共6层)  | 板楼,69,"11,405元/平"
怡景家园 电梯房 大三房 户型朝南 前后无遮挡 随时看,怡景佳园（六合） -大厂,3室1厅 | 99.98平米 | 南 | 其他 | 低楼层(共18层)  | 板塔结合,144,"14,403元/平"
诚售 扬子三村 小三房 低总价 带暖气,扬子三村 -大厂,3室1厅 | 62.4平米 | 南 | 其他 | 高楼层(共6层)  | 板楼,70,"11,218元/平"
主城区，配套成熟，诚心出售，采光好，带阁楼车库,名门花园 -六合主城,3室2厅 | 89.22平米 | 南 | 精装 | 高楼层(共6层)  | 板楼,78,"8,743元/平"
地铁口 大三房 带储藏室 产权清晰 拎包入住,芳庭潘园 -大厂,3室1厅 | 90.06平米 | 南 | 其他 | 高楼层(共6层)  | 板楼,123,"13,658元/平"
晓山北村 紧靠卸甲甸地铁站 户型方正 房主诚心出售,晓山北村 -大厂,2室2厅 | 81.98平米 | 南 北 | 其他 | 中楼层(共6层)  | 板楼,95,"11,589元/平"
旭东新城旁兰亭苑精装大两房 品质小区S8大厂站,荣盛兰亭苑 -大厂,2室1厅 | 93.41平米 | 南 | 其他 | 低楼层(共28层)  | 板楼,142,"15,202元/平"
精选单室 拎包入住 地铁口 总价低,芳庭潘园 -大厂,1室1厅 | 42.79平米 | 东南 | 精装 | 高楼层(共6层)  | 板楼,66,"15,425元/平"
城东新苑二期  采光好 毛坯房 无纠纷,城东新苑二期 -六合其它,2室1厅 | 94.56平米 | 南 | 毛坯 | 高楼层(共18层)  | 板楼,58,"6,134元/平"
此房南北户型格局，全新精装修，保养好，看房方便,紫艺华府 -大厂,4室2厅 | 133平米 | 南 北 | 其他 | 低楼层(共18层)  | 板楼,288,"21,655元/平"
此房位于江北新区南信大地铁口，两房朝南，精装,鑫庭雅苑 -大厂,2室1厅 | 81平米 | 南 | 简装 | 高楼层(共6层)  | 板楼,115,"14,198元/平"
周洼新村 2室1厅 东南,周洼新村 -大厂,2室1厅 | 81.8平米 | 东南 | 其他 | 低楼层(共6层)  | 板塔结合,115,"14,059元/平"
大厂商圈阿尔卡迪亚刚需两房设施齐全拎包入住,荣盛阿尔卡迪亚 -大厂,2室2厅 | 68.61平米 | 南 | 其他 | 高楼层(共18层)  | 板楼,86,"12,535元/平"
杨庄西村 满五唯一 双南 全明 卸甲甸地铁站旁,杨庄西村 -大厂,2室1厅 | 59.26平米 | 南 | 其他 | 高楼层(共6层)  | 板楼,68,"11,475元/平"
新华四村 暖气房 有储藏室 急售 可谈,新华四村 -大厂,2室2厅 | 64.33平米 | 南 | 简装 | 高楼层(共6层)  | 板塔结合,62,"9,638元/平"
钻石星城  成熟地段 有钥匙随时看房,钻石星城 -大厂,2室1厅 | 84.44平米 | 南 | 其他 | 中楼层(共30层)  | 板塔结合,95,"11,251元/平"
地铁口 草芳新苑顶楼带阁楼两房 房主诚心卖,草芳新苑 -大厂,2室1厅 | 58.27平米 | 南 | 简装 | 高楼层(共6层)  | 板楼,85,"14,588元/平"
紫艺华府 集中供暖 银城物业 刚需三居室 诚心出售,紫艺华府 -大厂,3室2厅 | 94.42平米 | 南 | 毛坯 | 低楼层(共18层)  | 板楼,117,"12,392元/平"
梧桐世家 简装修 三房  价格可谈,亚泰梧桐世家 -大厂,3室2厅 | 109.54平米 | 南 | 其他 | 高楼层(共26层)  | 板楼,140,"12,781元/平"
腾泰雅苑 3室1厅 南,腾泰雅苑 -大厂,3室1厅 | 109.36平米 | 南 | 其他 | 中楼层(共7层)  | 板楼,165,"15,088元/平"
杨庄北村 实用单室  位置采光好 配套成熟 诚心出售,杨庄北村 -大厂,1室1厅 | 40.43平米 | 南 | 其他 | 高楼层(共6层)  | 板楼,50,"12,368元/平"
莉湖春晓，小户型，目前空置， 随时看房 接受正常首付,荣盛莉湖春晓 -南门新城,2室1厅 | 76.18平米 | 南 | 其他 | 低楼层(共28层)  | 板塔结合,98,"12,865元/平"
中岛花园 3室2厅 南,中岛花园 -六合其它,3室2厅 | 110.51平米 | 南 | 其他 | 高楼层(共24层)  | 暂无数据,99,"8,959元/平"
房型方正，楼层好，采光足，适合刚需人群,湖滨村 -大厂,2室1厅 | 58.13平米 | 南 | 其他 | 中楼层(共7层)  | 板楼,66,"11,354元/平"
此房业主当面沟通，业主置换房屋 诚心出售,鹭岛南苑 -六合其它,3室1厅 | 116.8平米 | 南 | 其他 | 高楼层(共27层)  | 暂无数据,95,"8,134元/平"
户型方正，交通便利，楼层好，采光充足。,荣盛华府一期 -南门新城,4室2厅 | 144.75平米 | 南 北 | 其他 | 中楼层(共6层)  | 板塔结合,292,"20,173元/平"
此房南北户型格局，双卧朝南，客厅带阳台 户型全明通,紫艺华府 -大厂,3室2厅 | 105.89平米 | 南 北 | 毛坯 | 高楼层(共18层)  | 板楼,162,"15,299元/平"
此房满五唯一 ，买一得一，得房率高 ，配套好,福基九龙新城 -大厂,3室2厅 | 99.67平米 | 南 | 精装 | 高楼层(共7层)  | 板楼,100,"10,034元/平"
此房满五年两房朝南 简单装修 采光充足 配套设施齐全,杨庄北村 -大厂,2室1厅 | 58.96平米 | 南 | 简装 | 高楼层(共6层)  | 板楼,76,"12,891元/平"
扬子三房暖气房，地理位置号，交通便利,扬子十七村 -大厂,3室1厅 | 73平米 | 南 | 其他 | 高楼层(共6层)  | 板楼,105,"14,384元/平"
地铁口 扬子二十村 暖气房 满五唯一 朝南 户型方,扬子二十村 -大厂,2室2厅 | 98.7平米 | 南 | 其他 | 高楼层(共26层)  | 板楼,140,"14,185元/平"
永恒家园 交通方便 业主急售 楼层好,永恒家园二期 -大厂,2室2厅 | 96.91平米 | 南 | 简装 | 高楼层(共28层)  | 板塔结合,115,"11,867元/平"
碧景山庄结婚装修双阳台卧室客厅都朝南,碧景山庄 -大厂,2室2厅 | 87.47平米 | 南 北 | 精装 | 高楼层(共18层)  | 板塔结合,105,"12,005元/平"
扬子二十一村集中供暖大两房双南户型采光好,扬子二十一村 -大厂,2室1厅 | 77.67平米 | 南 | 简装 | 低楼层(共18层)  | 板楼,120,"15,450元/平"
鹭岛南苑 毛坯三房 中上楼层 采光全天,鹭岛南苑 -六合其它,3室2厅 | 104.53平米 | 南 北 | 毛坯 | 高楼层(共24层)  | 塔楼,83,"7,941元/平"
南北户型，楼层好。视野宽阔。采光充足。,鹭岛南苑 -六合其它,3室2厅 | 116.8平米 | 南 | 其他 | 高楼层(共27层)  | 暂无数据,93,"7,963元/平"
荣盛首府 3室2厅 南,荣盛首府 -大厂,3室2厅 | 126.78平米 | 南 | 其他 | 高楼层(共18层)  | 板楼,230,"18,142元/平"
新都雅苑 新空毛坯两房 交通便利 配套成熟 繁华商圈,城开新都雅苑 -南门新城,2室2厅 | 75.78平米 | 南 | 其他 | 高楼层(共18层)  | 板楼,98,"12,933元/平"
S8号线龙池站 纯毛坯 次新房 钥匙在手 看房随时,冠城大通三期竹苑 -龙池,2室1厅 | 75.16平米 | 南 | 其他 | 中楼层(共18层)  | 板塔结合,76,"10,112元/平"
梧桐世家 业主精装30万 拎包入住 楼层好 视野开阔,亚泰梧桐世家 -大厂,3室2厅 | 124.61平米 | 南 北 | 其他 | 低楼层(共27层)  | 板楼,146,"11,717元/平"
仁锦苑 电梯三房 业主诚售 中间楼层,仁锦苑 -大厂,3室1厅 | 93.05平米 | 南 | 其他 | 高楼层(共33层)  | 板楼,120,"12,897元/平"
山潘四村 难道出来的小两室 陪读的看过来,山潘四村 -大厂,2室1厅 | 46.99平米 | 南 | 其他 | 低楼层(共6层)  | 板楼,81,"17,238元/平"
葛塘新城 梧桐世家 品质小区 提包入住,亚泰梧桐世家 -大厂,2室2厅 | 80.26平米 | 南 | 其他 | 高楼层(共26层)  | 板楼,96,"11,962元/平"
冠城大通二期 毛坯三房 满五唯一 中上楼层 配套成熟,冠城大通二期松苑 -龙池,3室2厅 | 86.85平米 | 南 | 其他 | 中楼层(共18层)  | 板楼,104,"11,975元/平"
阿尔卡迪亚 满五年 精装修 电梯房 三房 户型好 采光好,荣盛阿尔卡迪亚 -大厂,3室1厅 | 110.01平米 | 南 | 其他 | 低楼层(共9层)  | 板楼,159,"14,454元/平"
朝南户型三房全明带大院子养花草养休狗,新华五村 -大厂,3室1厅 | 73.56平米 | 南 | 其他 | 低楼层(共7层)  | 板楼,145,"19,712元/平"
新华二村 2室1厅 南,新华二村 -大厂,2室1厅 | 53.04平米 | 南 | 其他 | 高楼层(共6层)  | 板塔结合,55,"10,370元/平"
欢乐港龙津广场大三房，带车位一个，采光无遮挡,龙津广场C区 -南门新城,3室2厅 | 118平米 | 南 北 | 毛坯 | 高楼层(共18层)  | 板塔结合,165,"13,984元/平"
鑫庭雅苑 满五 精装修拎包入住 价格可谈 诚心出售,鑫庭雅苑 -大厂,3室2厅 | 72.36平米 | 南 | 简装 | 高楼层(共6层)  | 板楼,89,"12,300元/平"
配套成熟 电梯房 楼层好 品质小区 房龄新,恒丰世家 -大厂,3室1厅 | 105.01平米 | 南 | 其他 | 低楼层(共18层)  | 板塔结合,155,"14,761元/平"
此房满五年唯一 3房正规暖气足  配套齐全,扬子九村 -大厂,3室1厅 | 65.73平米 | 南 | 其他 | 高楼层(共6层)  | 板楼,70,"10,650元/平"
户型方正，得房率高，看房方便，楼层好,山畔二村 -大厂,3室1厅 | 86.9平米 | 南 | 其他 | 中楼层(共7层)  | 暂无数据,95,"10,933元/平"
碧景山庄 户型方正 楼层好 采光好 配套成熟,碧景山庄 -大厂,2室1厅 | 87.91平米 | 南 | 其他 | 低楼层(共18层)  | 板塔结合,117,"13,310元/平"
紫艺华府 3室2厅 南,紫艺华府 -大厂,3室2厅 | 103.73平米 | 南 | 其他 | 高楼层(共18层)  | 板楼,200,"19,281元/平"
扬子二十一村 暖气房 精装自住 卖房诚心,扬子二十一村 -大厂,2室1厅 | 80.3平米 | 南 | 其他 | 低楼层(共12层)  | 板楼,135,"16,812元/平"
亚泰梧桐世家 3室2厅 南,亚泰梧桐世家 -大厂,3室2厅 | 105.34平米 | 南 | 其他 | 低楼层(共26层)  | 板楼,120,"11,392元/平"
旭东新城又低价好房，楼层好装修不错，有租的车位,福基旭东新城 -大厂,3室2厅 | 110.53平米 | 南 | 其他 | 中楼层(共11层)  | 板楼,173,"15,652元/平"
凤滨嘉园 电梯三房 户型方正 配套齐全 满五年唯一,福基九龙新城 -大厂,3室1厅 | 89.31平米 | 南 北 | 其他 | 中楼层(共11层)  | 板楼,135,"15,116元/平"
扬子暖气好房 正规三房朝南  采光刺眼 非顶楼…,扬子九村 -大厂,3室1厅 | 77.46平米 | 南 | 其他 | 高楼层(共6层)  | 板楼,110,"14,201元/平"
龙海骏景，精装修两房，拎包入住，采光不挡,龙海骏景 -六合其它,2室1厅 | 89.1平米 | 南 | 简装 | 低楼层(共18层)  | 板塔结合,108,"12,122元/平"
福基凤滨嘉园 3室2厅1厨2卫 电梯房 顶楼带阁楼 精装修,福基九龙新城 -大厂,5室2厅 | 179.84平米 | 南 | 其他 | 高楼层(共11层)  | 板楼,199,"11,066元/平"
圣得山庄：房主诚意出售，好房选好客，骤降20万。,圣得山庄 -大厂,3室1厅 | 95.43平米 | 南 | 精装 | 低楼层(共6层)  | 板楼,148,"15,509元/平"
扬子十二村扬子葛塘地铁口集中供暖拎包入住,扬子十二村 -大厂,3室1厅 | 76.03平米 | 南 | 简装 | 高楼层(共6层)  | 板塔结合,100,"13,153元/平"
扬子六村 中间楼层 业主诚心急售 看房随时方便,扬子六村 -大厂,2室1厅 | 57.58平米 | 南 | 简装 | 中楼层(共6层)  | 板楼,75,"13,026元/平"
珑翠芳庭 3室1厅 南 北,珑翠芳庭 -六合主城,3室1厅 | 89.87平米 | 南 北 | 精装 | 高楼层(共15层)  | 板塔结合,112,"12,463元/平"
此房满五， 电梯三房，厅带阳台，位置好，配套齐全,福基九龙新城 -大厂,3室2厅 | 119.12平米 | 南 | 精装 | 中楼层(共11层)  | 板楼,158,"13,264元/平"
荣盛华府 大三房 欢乐港 龙湖天街 钥匙在手,荣盛华府 -南门新城,3室2厅 | 108平米 | 南 北 | 毛坯 | 低楼层(共34层)  | 板塔结合,142,"13,149元/平"
芳庭潘园一楼三房含13平储藏室 满五空置有钥匙随时看,芳庭潘园 -大厂,3室2厅 | 89.93平米 | 南 北 | 简装 | 低楼层(共6层)  | 板楼,135,"15,012元/平"
欣乐北村，中间楼层。简单装修。,欣乐新村(北区) -大厂,2室1厅 | 82.37平米 | 南 | 其他 | 中楼层(共6层)  | 板楼,99,"12,019元/平"
此房满五年，唯一，低楼层，养老自住即可,桂馨园 -大厂,2室2厅 | 87.85平米 | 南 | 其他 | 低楼层(共6层)  | 板楼,130,"14,798元/平"
全明户型，楼层好，采光充足，配套设施齐全，交通便利,湖滨村 -大厂,3室2厅 | 69.17平米 | 南 | 其他 | 高楼层(共6层)  | 板楼,80,"11,566元/平"
紧靠地铁口，交通方便，旭东，信大，诚心出售，满五年,晓山北村 -大厂,2室2厅 | 78.35平米 | 南 北 | 其他 | 低楼层(共6层)  | 板塔结合,100,"12,764元/平"
福基旭东新城 3室1厅 南 北,福基旭东新城 -大厂,3室1厅 | 89.03平米 | 南 北 | 其他 | 高楼层(共11层)  | 板楼,150,"16,849元/平"
此房小区中间位置 中上楼层 采光很好  有钥匙随时可看,荣盛阿尔卡迪亚 -大厂,2室2厅 | 89.32平米 | 南 | 其他 | 高楼层(共18层)  | 板楼,130,"14,555元/平"
边户户型，视野采光不错，户型方正，.....,荣盛茉莉苑北园 -龙池,3室2厅 | 92.06平米 | 南 北 | 其他 | 中楼层(共18层)  | 暂无数据,98,"10,646元/平"
山潘一村，近南化四小 两房一厅，居家装修， 诚心出售,山潘一村 -大厂,2室2厅 | 63.56平米 | 南 | 其他 | 高楼层(共5层)  | 板楼,88,"13,846元/平"
