地铁口 小三房二次装修  视野宽阔 碧桂园凤凰城柏丽湾,碧桂园凤凰城柏丽湾 -凤凰城商圈,3室2厅 | 90.42平米 | 南 | 精装 | 高楼层(共32层)  | 塔楼,54,"5,973元/平"
温馨随变小四房，房主诚心出售，没住过人,碧桂园凤凰城星悦湾 -凤凰城商圈,4室2厅 | 121.47平米 | 南 | 精装 | 低楼层(共33层)  | 塔楼,96,"7,904元/平"
低总价 小区绿化多样环境好，配套设施齐全,恒大雅苑 -宝华商圈,2室1厅 | 80平米 | 南 | 简装 | 高楼层(共33层)  | 塔楼,57,"7,125元/平"
此房户型方正 采光好 视野好  随时过户,四季金辉 -宝华商圈,3室2厅 | 86.39平米 | 南 | 毛坯 | 高楼层(共34层)  | 塔楼,68,"7,872元/平"
万达茂旁 精装三房 楼层及户型好 采光无遮挡交通便利,彩虹城 -宝华商圈,3室2厅 | 83.74平米 | 南 | 精装 | 高楼层(共33层)  | 板楼,80,"9,554元/平"
业主诚心出售，楼层好，视野宽阔,恒大雅苑 -宝华商圈,2室2厅 | 95.91平米 | 南 | 简装 | 中楼层(共32层)  | 塔楼,73,"7,612元/平"
：房子户型好，全南户型，交通方便，大飘窗，采光好,春天里 -宝华商圈,3室2厅 | 118.5平米 | 南 | 简装 | 低楼层(共32层)  | 板塔结合,66,"5,570元/平"
碧桂园凤凰城 凤鸣苑大三房137平米可拎包入住,碧桂园凤凰城凤鸣苑 -凤凰城商圈,3室2厅 | 136.94平米 | 南 | 简装 | 低楼层(共29层)  | 塔楼,67,"4,893元/平"
小区环境优美内有人工湖出行便利近商场户型方正,碧桂园凤凰城柏丽湾 -凤凰城商圈,3室1厅 | 90.41平米 | 南 | 简装 | 中楼层(共32层)  | 塔楼,53,"5,863元/平"
央企招商 精装三房 高楼层 视野好 无贷款 有车位,招商国际E城 -宝华商圈,3室2厅 | 92.98平米 | 南 | 精装 | 高楼层(共34层)  | 板楼,94,"10,110元/平"
满五唯一，户型方正，采光一级棒 中楼层，视野好！,五星家园 -句容主城商圈,2室1厅 | 86.91平米 | 南 | 毛坯 | 中楼层(共32层)  | 板楼,50,"5,754元/平"
此房低楼层，户型好，楼层好，视野开阔，采光充足,香溪湾 -句容主城商圈,3室2厅 | 133平米 | 东 东南 | 精装 | 低楼层(共27层)  | 暂无数据,133.5,"10,038元/平"
品质小区，端正户型，采光通风好,金樾公馆 -句容主城商圈,3室2厅 | 126.63平米 | 南 | 精装 | 高楼层(共24层)  | 板楼,126,"9,951元/平"
急急急，业主着急出售，户型方正 有钥匙随时看房,碧桂园世纪城邦 -郭庄商圈,3室2厅 | 99平米 | 南 | 精装 | 中楼层(共30层)  | 板楼,61,"6,162元/平"
小区中间位置，楼间距大，视野开阔,碧桂园世纪城邦 -郭庄商圈,3室2厅 | 116平米 | 南 | 精装 | 低楼层(共27层)  | 板楼,82,"7,069元/平"
上书房 品质小区   一级物业,上書房 -句容主城商圈,3室2厅 | 114.23平米 | 南 北 | 毛坯 | 低楼层(共33层)  | 板楼,80,"7,004元/平"
金樾公馆 3室1厅 东南,金樾公馆 -句容主城商圈,3室1厅 | 97.53平米 | 东南 | 毛坯 | 中楼层(共24层)  | 板楼,80,"8,203元/平"
城东实惠房源业主诚心，满两年。,建中御东国际六期 -句容主城商圈,3室2厅 | 89.28平米 | 南 | 毛坯 | 高楼层(共34层)  | 板楼,59,"6,609元/平"
新城樾府 三房两厅  交通便利,新城樾府 -句容主城商圈,3室2厅 | 98平米 | 东南 | 精装 | 低楼层(共32层)  | 塔楼,85,"8,674元/平"
温馨随变小四房，房主诚心出售，没住过人,碧桂园凤凰城星悦湾 -凤凰城商圈,4室2厅 | 121.47平米 | 南 | 精装 | 低楼层(共33层)  | 塔楼,96,"7,904元/平"
央企招商 精装三房 高楼层 视野好 无贷款 有车位,招商国际E城 -宝华商圈,3室2厅 | 92.98平米 | 南 | 精装 | 高楼层(共34层)  | 板楼,94,"10,110元/平"
小区环境优美内有人工湖出行便利近商场户型方正,碧桂园凤凰城柏丽湾 -凤凰城商圈,3室1厅 | 90.41平米 | 南 | 简装 | 中楼层(共32层)  | 塔楼,53,"5,863元/平"
低总价 小区绿化多样环境好，配套设施齐全,恒大雅苑 -宝华商圈,2室1厅 | 80平米 | 南 | 简装 | 高楼层(共33层)  | 塔楼,57,"7,125元/平"
碧桂园凤凰城 好房推荐 有钥匙随时看房,云玺苑 -凤凰城商圈,3室1厅 | 133.2平米 | 南 北 | 精装 | 中楼层(共33层)  | 塔楼,78,"5,856元/平"
地铁处 满五年 精装三房 刚需者优先选择,碧桂园凤凰城柏丽湾 -凤凰城商圈,3室2厅 | 116.19平米 | 南 北 | 精装 | 中楼层(共32层)  | 塔楼,59.9,"5,156元/平"
南京碧桂园凤临湖苑湖景房全新装修有车位随时可以过户,碧桂园凤凰城临湖苑 -凤凰城商圈,3室2厅 | 126.37平米 | 东南 | 精装 | 中楼层(共33层)  | 塔楼,78,"6,173元/平"
四季金辉 满五唯一 楼层好 采光好 随时看房,四季金辉 -宝华商圈,2室2厅 | 73.29平米 | 南 北 | 毛坯 | 中楼层(共34层)  | 塔楼,82,"11,189元/平"
精装满二，随时可看，楼层好，视野开阔，采光充足。,碧桂园凤凰城凤鸣苑 -凤凰城商圈,3室2厅 | 138.79平米 | 南 | 精装 | 中楼层(共29层)  | 塔楼,82,"5,909元/平"
满二，刚需舒适三房，湖景优美，楼栋位置佳,碧桂园凤凰城临湖苑 -凤凰城商圈,3室1厅 | 125.98平米 | 南 | 精装 | 中楼层(共33层)  | 塔楼,86.1,"6,835元/平"
布局方正，视野宽阔，采光充足，配套设施,碧桂园凤凰城星悦湾 -凤凰城商圈,4室1厅 | 122.09平米 | 南 | 简装 | 高楼层(共33层)  | 塔楼,70,"5,734元/平"
人车分流小区，三开间朝南，楼间距大,中骏四季阳光 -句容主城商圈,3室2厅 | 125.62平米 | 南 北 | 毛坯 | 高楼层(共6层)  | 塔楼,92,"7,324元/平"
碧桂园凤凰城柏丽湾116户型全明户型满二无抵押随时过,碧桂园凤凰城柏丽湾 -凤凰城商圈,3室2厅 | 115.96平米 | 东南 | 简装 | 低楼层(共33层)  | 塔楼,64.9,"5,597元/平"
房东没住过 宝华山下小高层 国企开发,泰达青筑 -宝华商圈,3室2厅 | 132平米 | 南 | 精装 | 18层  | 板楼,155,"11,743元/平"
宝华多层电梯洋房 中间楼层 南北通透 环境优美,九曲花苑 -宝华商圈,3室1厅 | 82.59平米 | 南 北 | 毛坯 | 中楼层(共8层)  | 板塔结合,80,"9,687元/平"
濠锋星钻精装修带地暖业主2次装修家具家电齐全急售,濠锋星钻 -宝华商圈,2室2厅 | 83平米 | 南 | 精装 | 高楼层(共31层)  | 板塔结合,69,"8,314元/平"
优质好房源，靠商场校园，出行便捷，生活便利。,碧桂园凤凰城芷兰湾 -凤凰城商圈,3室2厅 | 117.08平米 | 南 | 简装 | 中楼层(共32层)  | 塔楼,63,"5,381元/平"
山景房 四房精装修   业主诚心售的   价格可以谈的！,碧桂园大学印象 -宝华商圈,4室2厅 | 127平米 | 南 | 精装 | 低楼层(共18层)  | 板楼,108,"8,504元/平"
品质小区 品牌物业 服务好 户型好,朗诗万都玲珑樾 -宝华商圈,3室1厅 | 94.69平米 | 南 | 毛坯 | 中楼层(共19层)  | 板塔结合,84,"8,872元/平"
四季金辉四房，东边户，中间楼层,四季金辉 -宝华商圈,4室2厅 | 107平米 | 南 北 | 毛坯 | 低楼层(共34层)  | 塔楼,75,"7,010元/平"
精装修两房 房东保养好  满两年 采光视野好,四季金辉 -宝华商圈,2室2厅 | 74.26平米 | 南 北 | 精装 | 高楼层(共34层)  | 塔楼,76,"10,235元/平"
四季金辉 万达茂 仙林大道旁 配套齐 随时看,四季金辉 -宝华商圈,3室2厅 | 79平米 | 南 | 毛坯 | 高楼层(共34层)  | 板楼,65,"8,228元/平"
四季金辉四房，东边户，中间楼层,四季金辉 -宝华商圈,4室2厅 | 107平米 | 南 北 | 毛坯 | 低楼层(共34层)  | 塔楼,75,"7,010元/平"
精装修两房 房东保养好  满两年 采光视野好,四季金辉 -宝华商圈,2室2厅 | 74.26平米 | 南 北 | 精装 | 高楼层(共34层)  | 塔楼,76,"10,235元/平"
汤山东 急售 精装修 急售 楼间距大,碧桂园凤凰城柏丽湾 -凤凰城商圈,3室2厅 | 115.77平米 | 南 | 简装 | 高楼层(共31层)  | 塔楼,70,"6,047元/平"
楼层好，位置安静，三房两卫，业主诚心出售,碧桂园凤凰城芷兰湾 -凤凰城商圈,3室1厅 | 117平米 | 南 | 精装 | 中楼层(共33层)  | 塔楼,115,"9,830元/平"
此房满两年  三房两卫  大三房  采光好  视野无遮挡,碧桂园凤凰城翰林湾 -凤凰城商圈,3室2厅 | 133.47平米 | 南 | 精装 | 中楼层(共33层)  | 塔楼,83,"6,219元/平"
地铁口，精装小三房，南北通透，满二无抵押,碧桂园凤凰城翰林湾 -凤凰城商圈,3室2厅 | 96.46平米 | 东南 南 北 | 精装 | 中楼层(共31层)  | 塔楼,61,"6,324元/平"
价格便宜 位置好 湖景房 大四房 业主诚心价格可谈,碧桂园凤凰城临湖苑 -凤凰城商圈,4室2厅 | 175.02平米 | 南 北 | 精装 | 低楼层(共31层)  | 塔楼,147,"8,400元/平"
看中价格可谈，房子一天未入住，配部分优家具,碧桂园凤凰城星悦湾 -凤凰城商圈,4室2厅 | 143.84平米 | 南 | 精装 | 高楼层(共33层)  | 塔楼,100,"6,953元/平"
恒大雅苑精装三房 双阳台 实木真皮定制家具,恒大雅苑 -宝华商圈,3室2厅 | 124.47平米 | 南 | 精装 | 低楼层(共33层)  | 塔楼,139,"11,168元/平"
地铁口，满两年，视野好，随时看房,碧桂园凤凰城翰林湾 -凤凰城商圈,3室2厅 | 92.34平米 | 南 | 精装 | 高楼层(共33层)  | 塔楼,80,"8,664元/平"
户型方正 位置好 采光无遮挡 好楼层,云玺苑 -凤凰城商圈,3室2厅 | 129.39平米 | 东南 | 简装 | 低楼层(共33层)  | 板塔结合,76,"5,874元/平"
业主诚意出售，出行方便，生活便利。,黄梅新村中区 -凤凰城商圈,4室1厅 | 127.68平米 | 东 南 | 精装 | 中楼层(共7层)  | 暂无数据,56,"4,386元/平"
泰达青筑 开发商精装新房 空置 满两年 优质楼层,泰达青筑 -宝华商圈,3室2厅 | 112.73平米 | 南 | 精装 | 高楼层(共18层)  | 板楼,80,"7,097元/平"
三房两厅一厨两卫  采光充足 交通便捷  购物方便,碧桂园凤凰城·凤仪苑 -凤凰城商圈,3室2厅 | 136.88平米 | 南 | 毛坯 | 低楼层(共30层)  | 塔楼,69,"5,041元/平"
西边户 采光好 景观楼层 拎包入住 业主诚售,京东紫晶 -宝华商圈,2室1厅 | 55.87平米 | 西南 | 精装 | 中楼层(共35层)  | 板塔结合,37.5,"6,713元/平"
楼层好，无遮挡，视野开阔 直达地铁口,碧桂园凤凰城柏丽湾 -凤凰城商圈,3室2厅 | 116.04平米 | 南 | 精装 | 中楼层(共32层)  | 塔楼,65,"5,602元/平"
中间楼层，位置好视野采光佳，纯边户全屋明亮,碧桂园翡翠华府 -宝华商圈,3室2厅 | 115.12平米 | 南 | 精装 | 低楼层(共33层)  | 板楼,107,"9,295元/平"
南北通透，采光充足，交通便利，户型方正,仙林悦城 -宝华商圈,3室2厅 | 90.68平米 | 南 北 | 简装 | 中楼层(共29层)  | 塔楼,69.8,"7,698元/平"
精装带地暖，户型正 采光好 无遮挡,碧桂园翡翠华府二期 -宝华商圈,4室2厅 | 140平米 | 南 北 | 精装 | 高楼层(共17层)  | 板楼,142,"10,143元/平"
房屋户型方正房屋宽敞布局分明采光好交通便利,天玺华府 -句容主城商圈,3室2厅 | 87.93平米 | 南 | 毛坯 | 高楼层(共31层)  | 板楼,80,"9,099元/平"
房子格局好，楼层好，采光足，视野好，朝南面多,碧桂园伯爵山 -宝华商圈,3室2厅 | 131平米 | 南 | 精装 | 低楼层(共18层)  | 板楼,148,"11,298元/平"
位于小区前排，前面无遮挡，景观好，离地铁口近。,碧桂园凤凰城翰林湾 -凤凰城商圈,3室2厅 | 91.17平米 | 南 | 精装 | 高楼层(共32层)  | 塔楼,72,"7,898元/平"
设施配套齐全，环境清静，小区楼间距大,碧桂园翡翠华府 -宝华商圈,3室1厅 | 115平米 | 南 | 精装 | 中楼层(共28层)  | 板楼,116,"10,087元/平"
满两年，业主诚心出售，全明。。。,仙林悦城 -宝华商圈,3室2厅 | 86.32平米 | 南 | 简装 | 低楼层(共33层)  | 塔楼,95,"11,006元/平"
南京仙林东 恒大雅苑旁 双地铁 前后无遮挡 无贷款,天正理想城 -宝华商圈,3室2厅 | 87.15平米 | 南 北 | 毛坯 | 高楼层(共34层)  | 塔楼,68,"7,803元/平"
四季金辉 万达茂 仙林大道旁 配套齐 随时看,四季金辉 -宝华商圈,3室2厅 | 79平米 | 南 | 毛坯 | 高楼层(共34层)  | 板楼,65,"8,228元/平"
南北格局好，采光好，视野开阔，朝南，户型方正,京东紫晶 -宝华商圈,3室2厅 | 109.85平米 | 南 北 | 毛坯 | 高楼层(共35层)  | 塔楼,140,"12,745元/平"
碧桂园世纪城邦    3室2厅,碧桂园世纪城邦 -郭庄商圈,3室1厅 | 116.13平米 | 南 | 精装 | 高楼层(共27层)  | 板楼,60,"5,167元/平"
地铁口，满两年，独立楼栋，视野好，,碧桂园凤凰城翰林湾 -凤凰城商圈,3室1厅 | 133.71平米 | 东南 | 精装 | 中楼层(共26层)  | 板楼,85,"6,358元/平"
业主诚心出售，满两年 小区中间，进出方便，地铁口,碧桂园凤凰城翰林湾 -凤凰城商圈,3室2厅 | 133.47平米 | 东南 南 | 精装 | 高楼层(共33层)  | 塔楼,77,"5,770元/平"
楼层好，环境优。采光棒，房子大，小区绿化不错。,云玺苑 -凤凰城商圈,4室2厅 | 192平米 | 南 北 | 精装 | 中楼层(共31层)  | 塔楼,125,"6,511元/平"
小区环境优美，物业好，诚心出售，交通便利。,台北上上城 -句容主城商圈,3室2厅 | 98.7平米 | 南 | 毛坯 | 高楼层(共6层)  | 板楼,68,"6,890元/平"
房子方正格局好，楼层好，采光足，视野开阔，朝南,春天里 -宝华商圈,2室1厅 | 101.81平米 | 南 | 毛坯 | 低楼层(共32层)  | 板塔结合,62.4,"6,130元/平"
地铁口旁，精装房， 视野采光好，满2年,碧桂园凤凰城翰林湾 -凤凰城商圈,3室2厅 | 133.55平米 | 南 | 精装 | 中楼层(共27层)  | 塔楼,95,"7,114元/平"
百米地铁口证满二诚心卖，楼层楼栋位置佳采光好,碧桂园凤凰城翰林湾 -凤凰城商圈,3室2厅 | 92.34平米 | 东 东南 | 简装 | 高楼层(共33层)  | 塔楼,49,"5,307元/平"
满两年，业主诚心出售，全明。。。,仙林悦城 -宝华商圈,3室2厅 | 86.32平米 | 南 | 简装 | 低楼层(共33层)  | 塔楼,95,"11,006元/平"
楼层好，无遮挡，视野开阔 直达地铁口,碧桂园凤凰城柏丽湾 -凤凰城商圈,3室2厅 | 116.04平米 | 南 | 精装 | 中楼层(共32层)  | 塔楼,65,"5,602元/平"
中间楼层，位置好视野采光佳，纯边户全屋明亮,碧桂园翡翠华府 -宝华商圈,3室2厅 | 115.12平米 | 南 | 精装 | 低楼层(共33层)  | 板楼,107,"9,295元/平"
南北通透，采光充足，交通便利，户型方正,仙林悦城 -宝华商圈,3室2厅 | 90.68平米 | 南 北 | 简装 | 中楼层(共29层)  | 塔楼,69.8,"7,698元/平"
房屋户型方正房屋宽敞布局分明采光好交通便利,天玺华府 -句容主城商圈,3室2厅 | 87.93平米 | 南 | 毛坯 | 高楼层(共31层)  | 板楼,80,"9,099元/平"
房子格局好，楼层好，采光足，视野好，朝南面多,碧桂园伯爵山 -宝华商圈,3室2厅 | 131平米 | 南 | 精装 | 低楼层(共18层)  | 板楼,148,"11,298元/平"
位于小区前排，前面无遮挡，景观好，离地铁口近。,碧桂园凤凰城翰林湾 -凤凰城商圈,3室2厅 | 91.17平米 | 南 | 精装 | 高楼层(共32层)  | 塔楼,72,"7,898元/平"
设施配套齐全，环境清静，小区楼间距大,碧桂园翡翠华府 -宝华商圈,3室1厅 | 115平米 | 南 | 精装 | 中楼层(共28层)  | 板楼,116,"10,087元/平"
户型通透格局好 业主诚卖 小区品质高 新房毛坯,四季金辉 -宝华商圈,4室2厅 | 105.58平米 | 南 北 | 毛坯 | 高楼层(共34层)  | 塔楼,86,"8,146元/平"
精装带地暖，户型正 采光好 无遮挡,碧桂园翡翠华府二期 -宝华商圈,4室2厅 | 140平米 | 南 北 | 精装 | 高楼层(共17层)  | 板楼,142,"10,143元/平"
碧桂园世纪城邦    3室2厅,碧桂园世纪城邦 -郭庄商圈,3室1厅 | 116.13平米 | 南 | 精装 | 高楼层(共27层)  | 板楼,60,"5,167元/平"
地铁口四房  视野佳 采光好 业主诚心出售,碧桂园凤凰城星悦湾 -凤凰城商圈,4室2厅 | 122平米 | 南 | 毛坯 | 高楼层(共30层)  | 塔楼,78.7,"6,451元/平"
楼层好，位置安静，三房两卫，业主诚心出售,碧桂园凤凰城芷兰湾 -凤凰城商圈,3室1厅 | 117平米 | 南 | 精装 | 中楼层(共33层)  | 塔楼,115,"9,830元/平"
万达茂旁 精装三房 小区成熟配套齐全交通便利生活方便,碧桂园翡翠华府二期 -宝华商圈,3室2厅 | 96.52平米 | 南 | 精装 | 低楼层(共32层)  | 塔楼,100,"10,361元/平"
此房业主诚心出售，满二，看房方便，小区环境好,碧桂园凤凰城凤雅苑 -凤凰城商圈,3室2厅 | 141.29平米 | 南 | 精装 | 低楼层(共29层)  | 塔楼,67.5,"4,778元/平"
楼层好，采光足，视野好，户型方正，诚心出售,仙林悦城 -宝华商圈,3室2厅 | 115.45平米 | 南 | 精装 | 高楼层(共33层)  | 板塔结合,98,"8,489元/平"
四季金辉 万达茂 仙林大道旁 配套齐 随时看,四季金辉 -宝华商圈,3室2厅 | 79平米 | 南 | 毛坯 | 高楼层(共34层)  | 板楼,65,"8,228元/平"
南北格局好，采光好，视野开阔，朝南，户型方正,京东紫晶 -宝华商圈,3室2厅 | 109.85平米 | 南 北 | 毛坯 | 高楼层(共35层)  | 塔楼,140,"12,745元/平"
碧桂园凤凰城翰林湾(句容-凤凰城商圈),碧桂园凤凰城翰林湾 -凤凰城商圈,3室1厅 | 92平米 | 南 | 精装 | 高楼层(共32层)  | 塔楼,72,"7,827元/平"
汤山东 急售 精装修 急售 楼间距大,碧桂园凤凰城柏丽湾 -凤凰城商圈,3室2厅 | 115.77平米 | 南 | 简装 | 高楼层(共31层)  | 塔楼,70,"6,047元/平"
南京仙林东 恒大雅苑旁 双地铁 前后无遮挡 无贷款,天正理想城 -宝华商圈,3室2厅 | 87.15平米 | 南 北 | 毛坯 | 高楼层(共34层)  | 塔楼,68,"7,803元/平"
户型方正，楼层好，视野宽阔，采光充足，贴心物业,朗诗万都玲珑樾 -宝华商圈,3室2厅 | 93平米 | 南 | 精装 | 中楼层(共19层)  | 板塔结合,110,"11,828元/平"
业主诚意出售，出行方便，生活便利。,黄梅新村中区 -凤凰城商圈,4室1厅 | 127.68平米 | 东 南 | 精装 | 中楼层(共7层)  | 暂无数据,56,"4,386元/平"
泰达青筑 开发商精装新房 空置 满两年 优质楼层,泰达青筑 -宝华商圈,3室2厅 | 112.73平米 | 南 | 精装 | 高楼层(共18层)  | 板楼,80,"7,097元/平"
三房两厅一厨两卫  采光充足 交通便捷  购物方便,碧桂园凤凰城·凤仪苑 -凤凰城商圈,3室2厅 | 136.88平米 | 南 | 毛坯 | 低楼层(共30层)  | 塔楼,69,"5,041元/平"
四室采光辣眼，户型方正无遮挡满二业主诚心卖南北通透,碧桂园凤凰城芷兰湾 -凤凰城商圈,4室1厅 | 173.24平米 | 南 北 | 精装 | 中楼层(共33层)  | 塔楼,110,"6,350元/平"
仙林东万达茂旁 紧靠南京 楼层中 采光无遮挡,和昌仙林国际 -宝华商圈,3室2厅 | 90平米 | 南 | 精装 | 高楼层(共29层)  | 板塔结合,72,"8,000元/平"
满二 精装修，采光好，随时看房,碧桂园凤凰城水蓝湾 -凤凰城商圈,3室1厅 | 92.19平米 | 南 | 精装 | 中楼层(共33层)  | 塔楼,47.8,"5,185元/平"
四季金辉一期2栋中高楼层东边户精装修带墙暖诚心出售,四季金辉 -宝华商圈,3室2厅 | 88平米 | 南 | 精装 | 高楼层(共34层)  | 塔楼,89,"10,114元/平"
万科物业 天玺华府 三房 毛坯 采光好 有钥匙 随时看房,天玺华府 -句容主城商圈,3室2厅 | 99.41平米 | 南 | 毛坯 | 高楼层(共18层)  | 板楼,71.8,"7,223元/平"
精装大四房，好楼层，房东忍痛出,建中御东国际六期 -句容主城商圈,3室2厅 | 99.77平米 | 东 南 北 | 精装 | 高楼层(共34层)  | 板楼,72.8,"7,297元/平"
央企楼盘 招商国际e城业主自住精装修保养好 随时看房,招商国际E城 -宝华商圈,2室2厅 | 78平米 | 南 | 精装 | 中楼层(共34层)  | 塔楼,74,"9,488元/平"
城东好房，四开间朝南，适合改善居住,兴都碧水铭苑 -句容主城商圈,3室2厅 | 126.35平米 | 南 北 | 精装 | 中楼层(共16层)  | 板塔结合,99.2,"7,852元/平"
小区环境优美，交通便利，有大型购物市场，,御东国际 -句容主城商圈,3室2厅 | 88.89平米 | 南 | 精装 | 中楼层(共33层)  | 板塔结合,73.8,"8,303元/平"
小高层户型，精装三房拎包入住，生活配套完善,阳光公寓 -句容主城商圈,3室2厅 | 135.58平米 | 南 | 精装 | 中楼层(共13层)  | 暂无数据,72,"5,311元/平"
全新户型，4.0双层隔音玻璃。自带百叶帘。高标准,紫悦府 -句容主城商圈,4室2厅 | 114.45平米 | 南 | 毛坯 | 低楼层(共33层)  | 塔楼,57.9,"5,059元/平"
宝华山脚下，山景房，户型方正，楼层好，看房方便！,碧桂园伯爵山 -宝华商圈,3室2厅 | 105.84平米 | 南 | 精装 | 高楼层(共18层)  | 板楼,70,"6,614元/平"
小区环境优美，物业好，诚心出售，交通便利。,台北上上城 -句容主城商圈,3室2厅 | 98.7平米 | 南 | 毛坯 | 高楼层(共6层)  | 板楼,68,"6,890元/平"
两房朝南，户型格局好，明厨明卫，客厅卧室大,泰达青筑 -宝华商圈,2室2厅 | 80.88平米 | 南 | 精装 | 低楼层(共18层)  | 板楼,63,"7,790元/平"
朗诗品质小区  人车分流  三开间朝南  山清水秀空气好,朗诗万都玲珑樾 -宝华商圈,3室1厅 | 93.34平米 | 南 | 毛坯 | 低楼层(共19层)  | 板塔结合,70,"7,500元/平"
仙林东 近地铁 品质小区 配套齐全 自住精装修业主急售,招商国际E城 -宝华商圈,3室2厅 | 118平米 | 南 北 | 精装 | 高楼层(共34层)  | 塔楼,120,"10,170元/平"
房东急售！ 嘉烨御花园 小高层 120平 精装修,嘉烨·御花园 -句容主城商圈,3室2厅 | 120平米 | 南 北 | 精装 | 高楼层(共18层)  | 板塔结合,104.5,"8,709元/平"
新房未住，带地暖，房东诚意出售，户型方正,句容恒大文化旅游城 -句容主城商圈,3室2厅 | 109.64平米 | 南 | 简装 | 中楼层(共19层)  | 板楼,68,"6,203元/平"
南北双阳台经典3房房东诚心卖房看房方便,碧桂园大学印象峰景苑 -宝华商圈,4室2厅 | 140平米 | 南 | 毛坯 | 高楼层(共17层)  | 板塔结合,110,"7,858元/平"
香山壹境 精装两房 环境优美 急售,香山壹境 -宝华商圈,2室2厅 | 80平米 | 南 | 精装 | 低楼层(共33层)  | 板楼,68,"8,500元/平"
京东紫晶亏本急卖自住装修边户山景房采光好 楼下菜场,京东紫晶 -宝华商圈,3室2厅 | 110.68平米 | 南 | 精装 | 高楼层(共34层)  | 塔楼,89.9,"8,123元/平"
京东紫晶 带地暖 中  央空调 全景阳台 景观房拎包入住,京东紫晶 -宝华商圈,2室1厅 | 73平米 | 南 | 精装 | 低楼层(共35层)  | 塔楼,85,"11,644元/平"
格局好楼层好，采光足视野开阔朝南 配套齐全交通便利,彩虹城 -宝华商圈,3室2厅 | 111.43平米 | 南 | 毛坯 | 中楼层(共33层)  | 板楼,90,"8,077元/平"
此房业主诚心出售，满二无抵押，高层位置好采光好,碧桂园凤凰城凤鸣苑 -凤凰城商圈,3室1厅 | 140.07平米 | 南 | 精装 | 高楼层(共27层)  | 塔楼,68,"4,855元/平"
格局好，楼层好，采光足，视野好,京东紫晶 -宝华商圈,2室1厅 | 68.82平米 | 南 | 毛坯 | 中楼层(共35层)  | 塔楼,50,"7,266元/平"
地铁口 四房 采光好 中间楼层,碧桂园凤凰城星悦湾 -凤凰城商圈,4室1厅 | 121.97平米 | 东南 | 毛坯 | 中楼层(共30层)  | 塔楼,65,"5,330元/平"
湖景房 近地铁 恒大雅苑三房 户型好  业主急售,恒大雅苑 -宝华商圈,3室2厅 | 104.71平米 | 南 | 精装 | 低楼层(共33层)  | 塔楼,83,"7,927元/平"
楼层好，环境优。采光棒，房子大，小区绿化不错。,云玺苑 -凤凰城商圈,4室2厅 | 192平米 | 南 北 | 精装 | 中楼层(共31层)  | 塔楼,125,"6,511元/平"
正正方方的房屋。采光很好，户型很好装修过的未入住,天正理想城 -宝华商圈,2室2厅 | 75平米 | 东南 | 精装 | 高楼层(共34层)  | 板楼,50,"6,667元/平"
房子方正格局好，楼层好，采光足，视野开阔，朝南,春天里 -宝华商圈,2室1厅 | 101.81平米 | 南 | 毛坯 | 低楼层(共32层)  | 板塔结合,62.4,"6,130元/平"
小区环境优美，交通便利，有大型购物市场，,御东国际 -句容主城商圈,3室2厅 | 88.89平米 | 南 | 精装 | 中楼层(共33层)  | 板塔结合,73.8,"8,303元/平"
小高层户型，精装三房拎包入住，生活配套完善,阳光公寓 -句容主城商圈,3室2厅 | 135.58平米 | 南 | 精装 | 中楼层(共13层)  | 暂无数据,72,"5,311元/平"
正正方方的房屋。采光很好，户型很好装修过的未入住,天正理想城 -宝华商圈,2室2厅 | 75平米 | 东南 | 精装 | 高楼层(共34层)  | 板楼,50,"6,667元/平"
湖景房 近地铁 恒大雅苑三房 户型好  业主急售,恒大雅苑 -宝华商圈,3室2厅 | 104.71平米 | 南 | 精装 | 低楼层(共33层)  | 塔楼,83,"7,927元/平"
业主诚心出售房子格局好，户型方正，主卧朝南有飘窗,恒大雅苑 -宝华商圈,2室2厅 | 89平米 | 南 | 精装 | 中楼层(共33层)  | 塔楼,70,"7,866元/平"
宝华山脚四A景区花园洋房环境优美鸟语花香,朗诗万都玲珑樾 -宝华商圈,3室2厅 | 94.69平米 | 南 | 毛坯 | 中楼层(共19层)  | 板塔结合,85,"8,977元/平"
湖景房 满五唯一 户型方正 总价低 刚需,碧桂园凤凰城水蓝湾 -凤凰城商圈,3室2厅 | 92平米 | 东南 南 | 简装 | 高楼层(共32层)  | 塔楼,65,"7,066元/平"
