龙池湖畔 时代商圈 七里楠花园 步梯洋房 总价低,骋望七里楠花园 -龙池,3室2厅 | 92.18平米 | 南 北 | 毛坯 | 高楼层(共5层)  | 板楼,95,"10,306元/平"
三房朝南 全明 户型方正 楼层好 精装修,腾泰雅苑 -大厂,3室2厅 | 97.8平米 | 南 北 | 简装 | 高楼层(共6层)  | 板楼,140,"14,315元/平"
盘金华府 2室1厅 南,盘金华府 -大厂,2室1厅 | 85平米 | 南 | 简装 | 高楼层(共6层)  | 板楼,128,"15,059元/平"
晓山北村 婚装3房 楼层好 采光充足 交通方便 拎包入住,晓山北村 -大厂,3室2厅 | 88平米 | 南 北 | 其他 | 高楼层(共6层)  | 板塔结合,130,"14,773元/平"
生活设施齐  房主诚心  视野好 无遮挡,荣盛茉莉苑北园 -龙池,2室1厅 | 66.56平米 | 南 | 精装 | 中楼层(共15层)  | 暂无数据,88,"13,222元/平"
长河郡 精装 大三房  满二 看中可谈。。,荣盛长河郡 -龙池,3室2厅 | 101.13平米 | 南 | 精装 | 低楼层(共18层)  | 板楼,118,"11,669元/平"
户型方正，交通便利，配套齐全，楼层好的好房源。,杨庄西村 -大厂,2室1厅 | 59.49平米 | 南 | 简装 | 低楼层(共6层)  | 暂无数据,65,"10,927元/平"
圣得山庄 大 三室 采光好 房东诚心卖,圣得山庄 -大厂,3室1厅 | 129.07平米 | 南 | 其他 | 高楼层(共6层)  | 板楼,160,"12,397元/平"
此房满五年   户型方正 拎包入住,圣得山庄 -大厂,3室2厅 | 122.49平米 | 南 | 简装 | 低楼层(共6层)  | 板楼,195,"15,920元/平"
鑫庭雅苑 近地铁 精装修拎包入住  诚心出售,鑫庭雅苑 -大厂,2室2厅 | 85.26平米 | 南 | 精装 | 高楼层(共6层)  | 板楼,118,"13,841元/平"
腾泰雅苑大三房 精装修 近二外 采光充足 交通便利,腾泰雅苑 -大厂,3室2厅 | 120.78平米 | 南 | 其他 | 中楼层(共7层)  | 板楼,220,"18,215元/平"
山潘三村    三房    位置好    出行方便   交通便利,山潘三村 -大厂,3室1厅 | 70.71平米 | 南 | 其他 | 高楼层(共6层)  | 板楼,105,"14,850元/平"
欧风花苑精装修三房楼层好户型好采光无遮挡,欧风花苑 -龙池,3室2厅 | 104.13平米 | 南 | 精装 | 低楼层(共6层)  | 板楼,105,"10,084元/平"
龙池地铁西侧 珠港花苑电梯三房 精装修 单价1.1 急售,珠港花苑 -龙池,3室1厅 | 117.35平米 | 南 北 | 精装 | 高楼层(共11层)  | 板楼,122,"10,397元/平"
荣盛文承苑 扬子二中旁 集中供暖社区 满五年 毛坯三居,荣盛文承苑 -大厂,3室2厅 | 98.29平米 | 南 | 简装 | 低楼层(共18层)  | 板塔结合,158,"16,075元/平"
此房南北互通 适宜居住 采光充足楼层好交通便利,桂馨园 -大厂,2室2厅 | 79.05平米 | 南 北 | 精装 | 中楼层(共6层)  | 板楼,118,"14,928元/平"
价格低，  交通便利，配套齐全，近育英二外。,化建新一村 -大厂,2室1厅 | 69.76平米 | 南 | 精装 | 低楼层(共11层)  | 暂无数据,88,"12,615元/平"
杨庄西村大套 电厂职工集资房 房屋质量很好 可抗震,杨庄西村 -大厂,3室2厅 | 101.89平米 | 南 | 简装 | 高楼层(共6层)  | 板塔结合,120,"11,778元/平"
杨庄北村 大三房 有教育 前后无遮挡 地铁沿线 可谈,杨庄北村 -大厂,3室1厅 | 72.45平米 | 南 北 | 精装 | 高楼层(共5层)  | 板楼,75,"10,352元/平"
品质小区 采光好 配套齐全 交通便利 可以直接拎包入住,欣乐新村(北区) -大厂,2室1厅 | 57.98平米 | 南 | 精装 | 高楼层(共6层)  | 板楼,95,"16,385元/平"
诚心出售，地铁口，精装婚房 ，拎包入住,荣鼎幸福城 -六合主城,2室2厅 | 81.85平米 | 南 | 精装 | 低楼层(共15层)  | 板楼,78,"9,530元/平"
地铁口三房 满两年，毛坯，中间楼层 ，配套完善,怡景佳园（六合） -大厂,3室1厅 | 99.98平米 | 南 | 毛坯 | 中楼层(共18层)  | 板塔结合,150,"15,004元/平"
阿尔卡迪亚 配套齐全 近地铁 生活方便,荣盛阿尔卡迪亚 -大厂,2室2厅 | 86.11平米 | 东南 | 精装 | 中楼层(共18层)  | 板楼,145,"16,839元/平"
新华四村中间楼层三房 三南户型好采光好 房主诚心卖,新华四村 -大厂,3室1厅 | 87.93平米 | 南 | 简装 | 低楼层(共6层)  | 板塔结合,105,"11,942元/平"
江北新区 卸甲甸 地铁站 架空一楼 精装修三房 采光好,宝润花园 -大厂,3室2厅 | 101.7平米 | 南 | 精装 | 低楼层(共6层)  | 板楼,145,"14,258元/平"
此房实用三居 位置采光好 配套齐全 生活方便 诚心出售,福基九龙新城 -大厂,4室1厅 | 134.72平米 | 南 | 精装 | 低楼层(共11层)  | 板楼,220,"16,331元/平"
大厂地铁口阿卡居家三房双卫 小高层采光好 有储藏室,荣盛阿尔卡迪亚 -大厂,3室2厅 | 108.08平米 | 南 | 精装 | 低楼层(共9层)  | 板楼,175,"16,192元/平"
桂馨园 楼上楼下2层 江北新区 交通方便 采光充足,桂馨园 -大厂,3室2厅 | 99.53平米 | 南 北 | 精装 | 高楼层(共6层)  | 板楼,122,"12,258元/平"
中间楼层 三开朝南 采光好 双阳台 小区安静,晓山路 -大厂,3室2厅 | 118.65平米 | 南 北 | 简装 | 高楼层(共6层)  | 暂无数据,177,"14,918元/平"
腾泰雅苑 精装三房 中间楼层 客厅带阳台 双阳台,腾泰雅苑 -大厂,3室2厅 | 105平米 | 南 北 | 其他 | 中楼层(共6层)  | 板楼,178,"16,953元/平"
此房南北互通 宜居住 采光充足 配套设施齐全 交通便利,紫晶环球生活广场 -大厂,3室2厅 | 128.6平米 | 南 北 | 简装 | 低楼层(共32层)  | 塔楼,260,"20,218元/平"
龙池湖 冠城三期 毛坯 满2年 楼层好 采光佳。,冠城大通三期竹苑 -龙池,3室1厅 | 98.85平米 | 东 | 其他 | 高楼层(共18层)  | 板塔结合,130,"13,152元/平"
集中供暖 此房满五年 精装拎包入住 配套齐全 交通便利,美利广场棠雅苑 -大厂,3室2厅 | 85.66平米 | 南 北 | 简装 | 低楼层(共11层)  | 板楼,180,"21,014元/平"
福基旭东新城 3室2厅 南 北,福基旭东新城 -大厂,3室2厅 | 112.88平米 | 南 北 | 精装 | 中楼层(共11层)  | 板楼,200,"17,718元/平"
龙池湖畔雨荷苑精装修三房拎包入住,雨荷苑 -龙池,3室2厅 | 95.61平米 | 南 北 | 精装 | 高楼层(共18层)  | 板楼,126,"13,179元/平"
南钢六村 交通方便 采光充足 地铁口 桃湖公园,大厂南钢六村 -大厂,2室1厅 | 52.43平米 | 南 北 | 简装 | 高楼层(共6层)  | 板塔结合,53,"10,109元/平"
此房满五唯一 地铁S8信息工程大学站口 桃湖公园旁,盘金华府 -大厂,3室2厅 | 112.71平米 | 南 北 | 精装 | 高楼层(共6层)  | 板楼,148,"13,132元/平"
育英二外旁 腾泰雅苑 三房 边户 全明 满五唯一,腾泰雅苑 -大厂,3室2厅 | 105平米 | 南 北 | 精装 | 高楼层(共6层)  | 板楼,156,"14,858元/平"
近桃湖公园 适用空间大， 交通便利 生活配套成熟,桂馨园 -大厂,2室2厅 | 78.21平米 | 南 | 简装 | 中楼层(共6层)  | 板楼,123,"15,727元/平"
卸甲甸地铁站 宝润花园 三房 拎包入住,宝润花园 -大厂,3室2厅 | 95.64平米 | 南 北 | 精装 | 低楼层(共6层)  | 板楼,110,"11,502元/平"
二外陪读 圣得山庄 朝南 小区安静 采光好 交通便利,圣得山庄 -大厂,2室2厅 | 85.12平米 | 南 | 精装 | 低楼层(共6层)  | 板楼,148,"17,388元/平"
南门新城 莉湖公园 滁河风光带 大面积三房 精装修,荣盛锦绣观邸 -南门新城,3室2厅 | 111.77平米 | 南 | 精装 | 低楼层(共18层)  | 板塔结合,147,"13,153元/平"
六合文馨花苑 实小旁边 精装修 三房一厅,文馨花苑 -南门新城,3室1厅 | 92.14平米 | 南 北 | 其他 | 高楼层(共17层)  | 板塔结合,142,"15,412元/平"
扬子十五村 2室1厅 南,扬子十五村 -大厂,2室1厅 | 64.05平米 | 南 | 简装 | 高楼层(共6层)  | 板楼,75,"11,710元/平"
百悦家小区 客厅朝南 户型方正 顶跃 诚售,百悦家花园 -大厂,4室2厅 | 118.87平米 | 南 北 | 精装 | 高楼层(共6层)  | 板楼,128,"10,769元/平"
精装拎包入住  近地铁  楼层好 采光佳 视野开阔,荣盛阿尔卡迪亚 -大厂,3室2厅 | 109.71平米 | 南 | 精装 | 低楼层(共18层)  | 板楼,210,"19,142元/平"
南京70年产权商品房 精装上下两层 大三房 配套设施全,六合雨花石文化园 -六合其它,3室2厅 | 110.05平米 | 南 北 | 精装 | 高楼层(共6层)  | 暂无数据,45,"4,090元/平"
次顶楼，南北通透，采光好，业主诚心出售，,棠新苑南苑 -六合其它,2室2厅 | 86.86平米 | 南 北 | 毛坯 | 高楼层(共11层)  | 板楼,67,"7,714元/平"
简装  ，交通方便  ，环境好。,周洼新村 -大厂,3室2厅 | 133.25平米 | 南 | 精装 | 高楼层(共6层)  | 板楼,165,"12,383元/平"
金都悦园  简装3房  房主急卖,金都悦园 -南门新城,3室2厅 | 111.32平米 | 南 | 精装 | 高楼层(共7层)  | 板楼,89,"7,995元/平"
精装修  楼层好 看房随时  交通便利,宝润花园 -大厂,2室2厅 | 91.3平米 | 南 | 精装 | 低楼层(共6层)  | 板楼,123,"13,473元/平"
中岛花园  简装  两房  满2  看中可谈  房主诚心出售,中岛花园 -六合其它,2室1厅 | 88.08平米 | 南 | 简装 | 低楼层(共24层)  | 塔楼,89,"10,105元/平"
江北新区 桃湖公园旁边  盘金华府 电梯房 适合养老,盘金华府 -大厂,2室2厅 | 86.26平米 | 东 西 | 精装 | 高楼层(共18层)  | 塔楼,125,"14,492元/平"
盘金华府 地铁口 顶楼带阁楼 拎包入住,盘金华府 -大厂,2室2厅 | 91.04平米 | 南 | 精装 | 高楼层(共6层)  | 板楼,113,"12,413元/平"
诚售 江北新区 芳庭潘园 卸甲甸 中间楼层,芳庭潘园 -大厂,2室1厅 | 76.95平米 | 南 | 毛坯 | 中楼层(共6层)  | 板楼,118,"15,335元/平"
南北互通，采光足，两房 朝南。,桂馨园 -大厂,2室2厅 | 79.13平米 | 南 | 简装 | 高楼层(共6层)  | 板楼,89,"11,248元/平"
精装暖气房 新房龄  好楼层 三房 电梯房,紫艺华府 -大厂,3室1厅 | 89.55平米 | 南 | 精装 | 高楼层(共17层)  | 板楼,168,"18,761元/平"
此房楼层好，房主诚心出售，看房提前打电话。,盘金华府 -大厂,2室2厅 | 90.28平米 | 南 | 精装 | 低楼层(共6层)  | 板楼,150,"16,615元/平"
好房急售 扬子九村 中间楼层 精装修 全明户型,扬子九村 -大厂,3室1厅 | 70.03平米 | 南 北 | 精装 | 中楼层(共6层)  | 板楼,105,"14,994元/平"
地铁口  精装俩房 拎包入住 有储藏室车位 通透,荣盛阿尔卡迪亚 -大厂,2室2厅 | 92平米 | 东南 | 精装 | 中楼层(共6层)  | 板楼,150,"16,305元/平"
新华五村新房子，阁楼及地下储藏室。,新华五村 -大厂,2室1厅 | 68.07平米 | 南 | 精装 | 高楼层(共6层)  | 板楼,128,"18,805元/平"
大厂地铁口阿卡居家装修大三房 中间楼层  满五唯一,荣盛阿尔卡迪亚 -大厂,3室1厅 | 120.54平米 | 南 | 精装 | 中楼层(共11层)  | 板楼,255,"21,155元/平"
江北新区 大厂街道 电梯房 精装修 配套成熟,恒丰世家 -大厂,3室2厅 | 107.19平米 | 南 | 精装 | 高楼层(共18层)  | 板塔结合,155,"14,461元/平"
福基旭东新城 中高楼层 3房 小区中间位置 近地铁,福基旭东新城 -大厂,3室1厅 | 92.01平米 | 南 | 精装 | 高楼层(共6层)  | 板楼,152,"16,520元/平"
欣乐南村满五年拎包入住南北互通采光好,欣乐新村(南区) -大厂,2室2厅 | 82.2平米 | 南 北 | 精装 | 中楼层(共6层)  | 板楼,116,"14,112元/平"
卸甲山庄大三房飞机户型 房型正 通风好 有储藏室,卸甲山庄 -大厂,3室1厅 | 127平米 | 南 | 简装 | 高楼层(共7层)  | 板楼,146,"11,497元/平"
城东岚苑  小区硬件设施新  中上楼层  价格好谈,城东岚苑 -六合其它,3室2厅 | 106.52平米 | 南 | 毛坯 | 高楼层(共18层)  | 板楼,75,"7,041元/平"
此房满五唯一 配套完善 交通便利 精装修 拎包入住,尚品馨苑 -大厂,3室2厅 | 140.72平米 | 南 | 精装 | 中楼层(共11层)  | 板楼,235,"16,700元/平"
六合区 幸福城 精装修 四房 两厅房主诚心出售,荣鼎幸福城 -六合主城,4室2厅 | 129.75平米 | 南 北 | 简装 | 低楼层(共15层)  | 板楼,105,"8,093元/平"
欣乐新村 满五唯一 二房朝南 有储藏室 中间楼层,欣乐新村(南区) -大厂,2室2厅 | 80.8平米 | 南 | 其他 | 中楼层(共6层)  | 板楼,107,"13,243元/平"
有储藏室，户型方正，好楼层，前无遮挡，采光充足,南钢四村2号院 -大厂,3室1厅 | 78.79平米 | 东南 | 简装 | 低楼层(共6层)  | 板塔结合,95,"12,058元/平"
江北新区 福基旭东新城 房主诚心出售 满五年 楼层好,福基旭东新城 -大厂,3室2厅 | 102.14平米 | 南 | 精装 | 中楼层(共11层)  | 板塔结合,225,"22,029元/平"
兰荷苑 大三房 精装修 欢乐港  仁和商场 满两年,兰荷苑 -南门新城,3室2厅 | 96.94平米 | 南 北 | 精装 | 中楼层(共6层)  | 板塔结合,85,"8,769元/平"
龙湖棠城 精装修 有汽车位 采光好 满两年,龙湖棠城 -南门新城,3室2厅 | 88.98平米 | 南 北 | 精装 | 中楼层(共20层)  | 板塔结合,155,"17,420元/平"
福基九龙新城 123平精装三房 配套成熟 交通方便,福基九龙新城 -大厂,3室2厅 | 123.26平米 | 南 | 精装 | 中楼层(共11层)  | 板楼,155,"12,576元/平"
视野好，采光充足，无遮挡，诚心出售。,荣盛金陵学府 -龙池,3室2厅 | 98.87平米 | 南 | 简装 | 高楼层(共18层)  | 板楼,108,"10,924元/平"
龙池雨荷苑精装修两房诚心出售采光好,雨荷苑 -龙池,2室1厅 | 76.33平米 | 南 北 | 精装 | 高楼层(共18层)  | 板楼,85,"11,136元/平"
龙池地铁站旁 龙庭世家 步梯5楼三房 总价低 诚心卖,龙庭世家 -龙池,3室2厅 | 98.48平米 | 南 北 | 精装 | 高楼层(共6层)  | 板楼,75,"7,616元/平"
银江花园 精装四房 采光好 配套全 提包入住,银江花园 -大厂,4室2厅 | 118.74平米 | 南 北 | 其他 | 中楼层(共6层)  | 板楼,210,"17,686元/平"
此房满五唯一，出行方便.环境优雅.南北互通....,盘金华府 -大厂,3室2厅 | 113.57平米 | 南 | 精装 | 中楼层(共6层)  | 板楼,188,"16,554元/平"
新广厦家园 满五年 带阁楼 小区安静 生活便捷 诚心售,新广厦家园 -大厂,3室2厅 | 89.06平米 | 南 | 其他 | 高楼层(共7层)  | 板楼,113,"12,689元/平"
冠城大通松苑 简装三居 业主诚售 满两年,冠城大通二期松苑 -龙池,4室2厅 | 108.36平米 | 南 | 简装 | 低楼层(共18层)  | 板楼,135,"12,459元/平"
满五年 近地铁 楼层好 采光佳 视野开阔 精装修,荣盛阿尔卡迪亚 -大厂,2室2厅 | 92.11平米 | 南 | 精装 | 中楼层(共6层)  | 板楼,125,"13,571元/平"
此房户型好，采光足，交通便利，配套齐全，拎包入住。,草芳新苑 -大厂,3室1厅 | 81.98平米 | 南 | 精装 | 高楼层(共6层)  | 板楼,113,"13,784元/平"
福基九龙新城 123平精装三房 配套成熟 交通方便,福基九龙新城 -大厂,3室2厅 | 123.26平米 | 南 | 精装 | 中楼层(共11层)  | 板楼,155,"12,576元/平"
扬子二十一村 暖气房 电梯 交通便利 配套齐全,扬子二十一村 -大厂,3室1厅 | 95.56平米 | 南 | 精装 | 高楼层(共18层)  | 板楼,155,"16,221元/平"
此房产权清晰。南北户型，楼层好。视野宽阔。,金汇花园 -六合主城,3室2厅 | 126.14平米 | 南 北 | 精装 | 中楼层(共6层)  | 板塔结合,126,"9,989元/平"
s8葛塘三室一厅 品牌物业小区环境好交通方便 价格优,亚泰梧桐世家 -大厂,3室2厅 | 96.94平米 | 南 北 | 简装 | 低楼层(共18层)  | 板楼,103,"10,626元/平"
华城名府 精装修3房  中间楼层  无户口 拎包入住,华城名府 -南门新城,3室2厅 | 100.11平米 | 南 | 精装 | 中楼层(共32层)  | 板楼,180,"17,981元/平"
凤南街 顶跃复式 拎包入住 满五唯一,凤南街22号 -大厂,2室1厅 | 86.8平米 | 南 | 精装 | 高楼层(共7层)  | 板楼,115,"13,249元/平"
桂馨园 满5年唯一 中间楼层 有储藏室 诚心出售,桂馨园 -大厂,2室2厅 | 78.21平米 | 南 | 其他 | 中楼层(共6层)  | 板楼,108,"13,809元/平"
山潘一村 出行方便，三房户型 ，好楼层， 诚心出售,山潘一村 -大厂,2室1厅 | 75.77平米 | 东南 | 简装 | 低楼层(共5层)  | 板楼,104,"13,726元/平"
江北新区 阿卡 改善三房 全新毛坯 好房出售,荣盛阿尔卡迪亚 -大厂,3室2厅 | 108.45平米 | 南 | 毛坯 | 中楼层(共11层)  | 板塔结合,206,"18,995元/平"
滨河新苑一期  三房精装  价格合理  交通便利  满五年,滨河新苑一期 -六合主城,3室2厅 | 95.86平米 | 南 | 精装 | 低楼层(共1层)  | 暂无数据,95,"9,911元/平"
荣盛首府 精装四居室 有集中供暖 居住使用时间不长,荣盛首府 -大厂,4室2厅 | 144.32平米 | 南 | 精装 | 中楼层(共18层)  | 板楼,288,"19,956元/平"
六合主城区 凤凰花园中间楼层 三房两厅房主诚心出售,凤凰花园(六合) -六合主城,3室2厅 | 98.69平米 | 南 北 | 精装 | 中楼层(共6层)  | 板楼,92,"9,323元/平"
南钢六村 面对美丽的桃湖公园 景观房 视野开阔地铁,大厂南钢六村 -大厂,3室1厅 | 84平米 | 南 北 | 简装 | 高楼层(共5层)  | 板塔结合,85,"10,120元/平"
：暖气房 地铁口 十七村菜场旁 位置佳 精装 拎包入住,扬子十七村 -大厂,3室1厅 | 64.57平米 | 南 | 简装 | 低楼层(共6层)  | 板楼,128,"19,824元/平"
湖滨新寓 居家两房 中间楼层 采光充沛 价格便宜,湖滨新寓 -大厂,2室1厅 | 61.2平米 | 南 | 简装 | 中楼层(共6层)  | 板楼,66,"10,785元/平"
丰盛凤凰左岸精装拎包入住采光好视野无遮挡,丰盛凤凰左岸 -六合主城,3室1厅 | 116.14平米 | 南 | 精装 | 高楼层(共18层)  | 板塔结合,135,"11,624元/平"
欣乐新村 大三房 三开间朝南 阳光充裕 价格可谈,欣乐新村(北区) -大厂,3室2厅 | 109.23平米 | 南 | 简装 | 高楼层(共6层)  | 板楼,175,"16,022元/平"
鑫庭雅苑 地铁口 总价低 电梯房出行方便 房主诚心,鑫庭雅苑 -大厂,2室1厅 | 81.06平米 | 南 | 其他 | 中楼层(共10层)  | 板楼,100,"12,337元/平"
鑫庭雅苑 满五 顶跃复式 价格可谈 诚心出售,鑫庭雅苑 -大厂,4室2厅 | 99.76平米 | 南 | 精装 | 高楼层(共6层)  | 板楼,155,"15,538元/平"
葛塘新城  长城新苑 精装修 有暖气 有储藏室,长城新苑 -大厂,2室1厅 | 89.84平米 | 南 | 精装 | 低楼层(共7层)  | 板楼,95,"10,575元/平"
紫艺华府 暖气毛坯大三房 南北户型 高品质小区,紫艺华府 -大厂,3室1厅 | 90.49平米 | 南 北 | 毛坯 | 低楼层(共17层)  | 板楼,115,"12,709元/平"
龙海新加坡花园城北区  精装婚房  满五年 采光充足,龙海新加坡花园城北区 -六合主城,3室2厅 | 135.33平米 | 南 北 | 简装 | 中楼层(共7层)  | 板楼,119,"8,794元/平"
此房双向朝南 户型方正 南 北全 通风,凤南园 -大厂,3室2厅 | 100.41平米 | 南 | 简装 | 中楼层(共7层)  | 板楼,110,"10,956元/平"
恒丰世家 买一层得两层  居家装修 随时看,恒丰世家 -大厂,3室2厅 | 124.28平米 | 南 | 精装 | 高楼层(共6层)  | 板塔结合,170,"13,679元/平"
葛塘新城 永恒家园 居家三房 S8葛塘站,永恒家园二期 -大厂,3室1厅 | 93.11平米 | 南 | 简装 | 高楼层(共26层)  | 板塔结合,119,"12,781元/平"
荣盛文承熙苑.全新小区.环境优美.电梯暖气房.,荣盛文承熙苑 -大厂,2室1厅 | 73.02平米 | 东南 | 精装 | 高楼层(共18层)  | 板楼,120,"16,434元/平"
欣乐新村 改善大三房 中间楼层 阳光好,欣乐新村(北区) -大厂,3室2厅 | 113.21平米 | 南 北 | 其他 | 中楼层(共6层)  | 板楼,140,"12,367元/平"
经典雅居 地铁口房 读书方便 阳光充足 配套齐全,经典雅居 -六合主城,3室1厅 | 101.19平米 | 南 北 | 精装 | 高楼层(共6层)  | 板塔结合,95,"9,389元/平"
名门花园 3房 满五年 有钥匙,名门花园 -六合主城,3室1厅 | 88.29平米 | 南 北 | 精装 | 高楼层(共6层)  | 板楼,115,"13,026元/平"
福基旭东新城 三期 次新房  电梯中上层  已装全屋地暖,福基旭东新城 -大厂,3室2厅 | 94.2平米 | 南 | 精装 | 高楼层(共11层)  | 板楼,188,"19,958元/平"
阿卡精装大两房 交通便利S8大厂站 实 小和旭东,荣盛阿尔卡迪亚 -大厂,2室1厅 | 89平米 | 东南 | 精装 | 高楼层(共18层)  | 板楼,124,"13,933元/平"
旭东新城精装三房 S8大厂站 品质小区 提包入住,福基旭东新城 -大厂,2室2厅 | 102.58平米 | 南 | 简装 | 高楼层(共21层)  | 板楼,220,"21,447元/平"
荣盛阿尔卡迪亚 大厂站地铁口 不占用 三房低价出售,荣盛阿尔卡迪亚 -大厂,3室2厅 | 118.67平米 | 南 北 | 精装 | 中楼层(共9层)  | 板楼,188,"15,843元/平"
桃湖公园，精致两房，楼层好，双南户型，采光好,湖滨村 -大厂,2室1厅 | 58.1平米 | 南 北 | 简装 | 中楼层(共6层)  | 板楼,69,"11,877元/平"
鑫庭雅苑 精装大三房 带阁楼 采光充沛 价格便宜,鑫庭雅苑 -大厂,3室2厅 | 110.84平米 | 南 | 精装 | 高楼层(共6层)  | 板楼,150,"13,534元/平"
精装修，双阳台，三房朝南，很好的改善选择,腾泰雅苑 -大厂,3室2厅 | 106.74平米 | 南 | 精装 | 高楼层(共6层)  | 板楼,148,"13,866元/平"
多层3楼 精装拎包入住 近地铁 诚心卖,荣盛阿尔卡迪亚 -大厂,2室1厅 | 89.73平米 | 南 | 简装 | 中楼层(共6层)  | 板楼,122,"13,597元/平"
此房满两年。楼层好。视野宽阔。采光充足。设施齐全,荣城东苑 -南门新城,3室1厅 | 89.82平米 | 南 | 精装 | 低楼层(共9层)  | 板楼,128,"14,251元/平"
江北新区 晓山北村 改善三房 带阁楼和露台 带储藏室,晓山北村 -大厂,3室1厅 | 92.05平米 | 南 | 精装 | 高楼层(共6层)  | 板塔结合,125,"13,580元/平"
幸福城 大三房 婚装 满五唯一 交通方便 随时看房,荣鼎幸福城 -六合主城,3室1厅 | 97.52平米 | 南 北 | 精装 | 中楼层(共15层)  | 板楼,100,"10,255元/平"
扬子暖气一楼带院子 两房朝南 客厅采光好,扬子十一村 -大厂,2室1厅 | 57.95平米 | 南 | 简装 | 低楼层(共6层)  | 暂无数据,95,"16,394元/平"
扬子十一村 2室1厅 南,扬子十一村 -大厂,2室1厅 | 52.81平米 | 南 | 简装 | 中楼层(共6层)  | 暂无数据,88,"16,664元/平"
一楼带院子，院子盖好阳光房 还有空地,杨庄南村 -大厂,3室1厅 | 64.57平米 | 南 | 精装 | 低楼层(共6层)  | 板楼,124,"19,204元/平"
欣乐新村 中间楼层 二室二厅 房主自居 满五唯一,欣乐新村(北区) -大厂,2室2厅 | 83.14平米 | 南 | 精装 | 中楼层(共6层)  | 板楼,130,"15,637元/平"
江北新区 文承熙苑 改善暖气三房 三十万自住装修,荣盛文承熙苑 -大厂,3室1厅 | 109.22平米 | 南 | 精装 | 高楼层(共18层)  | 板楼,238,"21,791元/平"
此房满五年，三房，户型方正，采光充足,荣盛阿尔卡迪亚 -大厂,3室2厅 | 109.88平米 | 南 | 精装 | 高楼层(共9层)  | 板楼,175,"15,927元/平"
恒丰世家 精装三房 配套全交通便利,恒丰世家 -大厂,3室2厅 | 114.39平米 | 南 北 | 精装 | 低楼层(共7层)  | 板塔结合,165,"14,425元/平"
一梯两户 大三房 三房朝南 楼层好，带暖气，采光充足,扬子四村 -大厂,3室1厅 | 77.01平米 | 南 北 | 简装 | 低楼层(共6层)  | 板楼,110,"14,284元/平"
凤滨嘉园  有储藏室 客厅朝南 地铁沿线 满五年,福基九龙新城 -大厂,2室2厅 | 83.11平米 | 南 北 | 精装 | 高楼层(共6层)  | 板楼,99,"11,912元/平"
滕泰雅苑满五唯一 南北朝向还是边户 旭东旁边,腾泰雅苑 -大厂,3室2厅 | 103.05平米 | 南 | 其他 | 中楼层(共6层)  | 板楼,175,"16,983元/平"
骋望七里楠花园3-2-1-1 94.32m² 127 万,骋望七里楠花园 -龙池,3室2厅 | 94.32平米 | 南 | 毛坯 | 中楼层(共5层)  | 板楼,80,"8,482元/平"
产权清晰。南北户型，视野宽阔。。。。。。,东骏华府 -六合其它,3室2厅 | 107.73平米 | 南 北 | 精装 | 低楼层(共11层)  | 板楼,58,"5,384元/平"
新华五村 三房两  双卧朝南   交通便利   配套齐全,新华五村 -大厂,3室2厅 | 114.27平米 | 南 | 简装 | 中楼层(共7层)  | 板楼,176,"15,403元/平"
邻近金牛湖畔 商品房产权 南北二房 厨卫厅全明 毛坯,百露园 -六合其它,2室2厅 | 85.54平米 | 南 北 | 毛坯 | 高楼层(共6层)  | 暂无数据,26,"3,040元/平"
汇锦水岸城 精装修 欢乐港 龙湖天街 随时看房,汇锦水岸城 -南门新城,3室2厅 | 91.2平米 | 南 北 | 精装 | 中楼层(共32层)  | 板楼,124,"13,597元/平"
近地铁 大三房 房主诚售 价格好谈,中杨新村 -大厂,3室1厅 | 116.94平米 | 南 | 简装 | 高楼层(共6层)  | 板楼,153,"13,084元/平"
三丰公寓 主要是孩子 优势是总价低 缺点是单体式住宅,三丰公寓 -大厂,3室2厅 | 103.09平米 | 南 | 精装 | 中楼层(共17层)  | 板楼,108,"10,477元/平"
此房业主诚售 大三房 交通生活便利 装修清爽 方便看房,恒丰世家 -大厂,3室2厅 | 105.01平米 | 东南 | 精装 | 中楼层(共18层)  | 板塔结合,150,"14,285元/平"
近地铁 大三房 房主诚售 价格好谈,中杨新村 -大厂,3室1厅 | 116.94平米 | 南 | 简装 | 高楼层(共6层)  | 板楼,153,"13,084元/平"
草芳新苑 卸甲甸地铁口  居家三房 带储藏室十六平,草芳新苑 -大厂,3室1厅 | 86.48平米 | 南 | 简装 | 高楼层(共6层)  | 板楼,90,"10,408元/平"
